{"id":278277,"items":[{"id":278278,"status":2,"title":"Page 2","order":0,"templateKey":null,"pageLinks":[]}],"metaTags":null,"order":"0","headHtml":null,"customCss":null,"headerHtml":"<section class=\"u-align-center-sm u-align-center-xs u-clearfix u-grey-15 u-header u-block-5e76-1\" custom-posts-hash=\"[]\" data-style=\"header-logo-menu-social-icons\" data-post-id=\"19679239\" data-section-properties=\"{&quot;grid-spacing&quot;:&quot;0&quot;,&quot;align&quot;:&quot;left&quot;,&quot;stretch&quot;:true}\" id=\"sec-6c30\" data-source=\"\" data-id=\"5e76\">\n  <div class=\"u-clearfix u-sheet u-block-5e76-2\" data-state=\"{&quot;margin-top&quot;:{&quot;shouldApplyDefaultMargins&quot;:{&quot;XL&quot;:false,&quot;LG&quot;:false,&quot;MD&quot;:false,&quot;SM&quot;:false,&quot;XS&quot;:false},&quot;parentVerticalAlign&quot;:{&quot;XL&quot;:&quot;&quot;,&quot;LG&quot;:&quot;&quot;,&quot;MD&quot;:&quot;&quot;,&quot;SM&quot;:&quot;&quot;,&quot;XS&quot;:&quot;&quot;}},&quot;margin-bottom&quot;:{&quot;shouldApplyDefaultMargins&quot;:{&quot;XL&quot;:false,&quot;LG&quot;:false,&quot;MD&quot;:false,&quot;SM&quot;:false,&quot;XS&quot;:false},&quot;parentVerticalAlign&quot;:{&quot;XL&quot;:&quot;&quot;,&quot;LG&quot;:&quot;&quot;,&quot;MD&quot;:&quot;&quot;,&quot;SM&quot;:&quot;&quot;,&quot;XS&quot;:&quot;&quot;}}}\">\n    \n    \n    \n  <div class=\"u-social-icons u-spacing-10 u-block-5e76-3\" data-state=\"{&quot;height&quot;:{&quot;iconCount&quot;:{&quot;XL&quot;:3,&quot;LG&quot;:3,&quot;MD&quot;:3,&quot;SM&quot;:3,&quot;XS&quot;:3},&quot;iconSpacing&quot;:{&quot;XL&quot;:10,&quot;LG&quot;:10,&quot;MD&quot;:10,&quot;SM&quot;:10,&quot;XS&quot;:10}},&quot;margin-top&quot;:{&quot;shouldApplyDefaultMargins&quot;:{&quot;XL&quot;:false,&quot;LG&quot;:false,&quot;MD&quot;:false,&quot;SM&quot;:false,&quot;XS&quot;:false},&quot;parentVerticalAlign&quot;:{&quot;XL&quot;:&quot;&quot;,&quot;LG&quot;:&quot;&quot;,&quot;MD&quot;:&quot;&quot;,&quot;SM&quot;:&quot;&quot;,&quot;XS&quot;:&quot;&quot;}},&quot;margin-bottom&quot;:{&quot;shouldApplyDefaultMargins&quot;:{&quot;XL&quot;:false,&quot;LG&quot;:false,&quot;MD&quot;:false,&quot;SM&quot;:false,&quot;XS&quot;:false},&quot;parentVerticalAlign&quot;:{&quot;XL&quot;:&quot;&quot;,&quot;LG&quot;:&quot;&quot;,&quot;MD&quot;:&quot;&quot;,&quot;SM&quot;:&quot;&quot;,&quot;XS&quot;:&quot;&quot;}},&quot;min-height&quot;:{&quot;iconCount&quot;:{&quot;XL&quot;:3,&quot;LG&quot;:3,&quot;MD&quot;:3,&quot;SM&quot;:3,&quot;XS&quot;:3},&quot;iconSpacing&quot;:{&quot;XL&quot;:10,&quot;LG&quot;:10,&quot;MD&quot;:10,&quot;SM&quot;:10,&quot;XS&quot;:10}},&quot;min-width&quot;:{&quot;iconCount&quot;:{&quot;XL&quot;:3,&quot;LG&quot;:3,&quot;MD&quot;:3,&quot;SM&quot;:3,&quot;XS&quot;:3},&quot;iconSpacing&quot;:{&quot;XL&quot;:10,&quot;LG&quot;:10,&quot;MD&quot;:10,&quot;SM&quot;:10,&quot;XS&quot;:10}},&quot;width&quot;:{&quot;iconCount&quot;:{&quot;XL&quot;:3,&quot;LG&quot;:3,&quot;MD&quot;:3,&quot;SM&quot;:3,&quot;XS&quot;:3},&quot;iconSpacing&quot;:{&quot;XL&quot;:10,&quot;LG&quot;:10,&quot;MD&quot;:10,&quot;SM&quot;:10,&quot;XS&quot;:10}}}\"><a class=\"u-social-url\" title=\"facebook\" target=\"_blank\" href=\"\"><span class=\"u-icon u-icon-circle u-social-facebook u-social-icon u-block-5e76-20\"><svg class=\"u-svg-link\" preserveAspectRatio=\"xMidYMin slice\" viewBox=\"0 0 112 112\" style=\"\"><use xlink:href=\"#svg-156a\"></use></svg><svg xmlns=\"http://www.w3.org/2000/svg\" xmlns:xlink=\"http://www.w3.org/1999/xlink\" version=\"1.1\" xml:space=\"preserve\" class=\"u-svg-content\" viewBox=\"0 0 112 112\" x=\"0\" y=\"0\" id=\"svg-156a\" data-color=\"#3b5998\"><circle fill=\"currentColor\" cx=\"56.1\" cy=\"56.1\" r=\"55\"></circle><path fill=\"#FFFFFF\" d=\"M73.5,31.6h-9.1c-1.4,0-3.6,0.8-3.6,3.9v8.5h12.6L72,58.3H60.8v40.8H43.9V58.3h-8V43.9h8v-9.2\n            c0-6.7,3.1-17,17-17h12.5v13.9H73.5z\"></path></svg></span></a><a class=\"u-social-url\" title=\"twitter\" target=\"_blank\" href=\"\"><span class=\"u-icon u-icon-circle u-social-icon u-social-twitter u-block-5e76-21\"><svg class=\"u-svg-link\" preserveAspectRatio=\"xMidYMin slice\" viewBox=\"0 0 112 112\" style=\"\"><use xlink:href=\"#svg-5904\"></use></svg><svg xmlns=\"http://www.w3.org/2000/svg\" xmlns:xlink=\"http://www.w3.org/1999/xlink\" version=\"1.1\" xml:space=\"preserve\" class=\"u-svg-content\" viewBox=\"0 0 112 112\" x=\"0\" y=\"0\" id=\"svg-5904\" data-color=\"#55acee\"><circle fill=\"currentColor\" class=\"st0\" cx=\"56.1\" cy=\"56.1\" r=\"55\"></circle><path fill=\"#FFFFFF\" d=\"M83.8,47.3c0,0.6,0,1.2,0,1.7c0,17.7-13.5,38.2-38.2,38.2C38,87.2,31,85,25,81.2c1,0.1,2.1,0.2,3.2,0.2\n            c6.3,0,12.1-2.1,16.7-5.7c-5.9-0.1-10.8-4-12.5-9.3c0.8,0.2,1.7,0.2,2.5,0.2c1.2,0,2.4-0.2,3.5-0.5c-6.1-1.2-10.8-6.7-10.8-13.1\n            c0-0.1,0-0.1,0-0.2c1.8,1,3.9,1.6,6.1,1.7c-3.6-2.4-6-6.5-6-11.2c0-2.5,0.7-4.8,1.8-6.7c6.6,8.1,16.5,13.5,27.6,14\n            c-0.2-1-0.3-2-0.3-3.1c0-7.4,6-13.4,13.4-13.4c3.9,0,7.3,1.6,9.8,4.2c3.1-0.6,5.9-1.7,8.5-3.3c-1,3.1-3.1,5.8-5.9,7.4\n            c2.7-0.3,5.3-1,7.7-2.1C88.7,43,86.4,45.4,83.8,47.3z\"></path></svg></span></a><a class=\"u-social-url\" title=\"instagram\" target=\"_blank\" href=\"\"><span class=\"u-icon u-icon-circle u-social-icon u-social-instagram u-block-5e76-22\"><svg class=\"u-svg-link\" preserveAspectRatio=\"xMidYMin slice\" viewBox=\"0 0 112 112\" style=\"\"><use xlink:href=\"#svg-b02b\"></use></svg><svg xmlns=\"http://www.w3.org/2000/svg\" xmlns:xlink=\"http://www.w3.org/1999/xlink\" version=\"1.1\" xml:space=\"preserve\" class=\"u-svg-content\" viewBox=\"0 0 112 112\" x=\"0\" y=\"0\" id=\"svg-b02b\" data-color=\"#c536a4\"><circle fill=\"currentColor\" cx=\"56.1\" cy=\"56.1\" r=\"55\"></circle><path fill=\"#FFFFFF\" d=\"M55.9,38.2c-9.9,0-17.9,8-17.9,17.9C38,66,46,74,55.9,74c9.9,0,17.9-8,17.9-17.9C73.8,46.2,65.8,38.2,55.9,38.2\n            z M55.9,66.4c-5.7,0-10.3-4.6-10.3-10.3c-0.1-5.7,4.6-10.3,10.3-10.3c5.7,0,10.3,4.6,10.3,10.3C66.2,61.8,61.6,66.4,55.9,66.4z\"></path><path fill=\"#FFFFFF\" d=\"M74.3,33.5c-2.3,0-4.2,1.9-4.2,4.2s1.9,4.2,4.2,4.2s4.2-1.9,4.2-4.2S76.6,33.5,74.3,33.5z\"></path><path fill=\"#FFFFFF\" d=\"M73.1,21.3H38.6c-9.7,0-17.5,7.9-17.5,17.5v34.5c0,9.7,7.9,17.6,17.5,17.6h34.5c9.7,0,17.5-7.9,17.5-17.5V38.8\n            C90.6,29.1,82.7,21.3,73.1,21.3z M83,73.3c0,5.5-4.5,9.9-9.9,9.9H38.6c-5.5,0-9.9-4.5-9.9-9.9V38.8c0-5.5,4.5-9.9,9.9-9.9h34.5\n            c5.5,0,9.9,4.5,9.9,9.9V73.3z\"></path></svg></span></a></div><nav class=\"u-align-left u-menu u-menu-dropdown u-offcanvas u-block-5e76-7\" data-state=\"{&quot;margin-top&quot;:{&quot;shouldApplyDefaultMargins&quot;:{&quot;XL&quot;:false,&quot;LG&quot;:false,&quot;MD&quot;:false,&quot;SM&quot;:false,&quot;XS&quot;:false},&quot;parentVerticalAlign&quot;:{&quot;XL&quot;:&quot;&quot;,&quot;LG&quot;:&quot;&quot;,&quot;MD&quot;:&quot;&quot;,&quot;SM&quot;:&quot;&quot;,&quot;XS&quot;:&quot;&quot;}},&quot;margin-bottom&quot;:{&quot;shouldApplyDefaultMargins&quot;:{&quot;XL&quot;:false,&quot;LG&quot;:false,&quot;MD&quot;:false,&quot;SM&quot;:false,&quot;XS&quot;:false},&quot;parentVerticalAlign&quot;:{&quot;XL&quot;:&quot;&quot;,&quot;LG&quot;:&quot;&quot;,&quot;MD&quot;:&quot;&quot;,&quot;SM&quot;:&quot;&quot;,&quot;XS&quot;:&quot;&quot;}},&quot;margin-left&quot;:{&quot;responsiveFrom&quot;:{&quot;XL&quot;:&quot;MD&quot;,&quot;LG&quot;:&quot;MD&quot;,&quot;MD&quot;:&quot;MD&quot;,&quot;SM&quot;:&quot;MD&quot;,&quot;XS&quot;:&quot;MD&quot;}},&quot;margin-right&quot;:{&quot;responsiveFrom&quot;:{&quot;XL&quot;:&quot;MD&quot;,&quot;LG&quot;:&quot;MD&quot;,&quot;MD&quot;:&quot;MD&quot;,&quot;SM&quot;:&quot;MD&quot;,&quot;XS&quot;:&quot;MD&quot;}}}\">\n      <div class=\"menu-collapse\" style=\"font-size: 1rem; letter-spacing: 0px; font-weight: 700;\">\n        <a class=\"u-button-style u-custom-active-border-color u-custom-active-color u-custom-border u-custom-border-color u-custom-borders u-custom-hover-border-color u-custom-hover-color u-custom-left-right-menu-spacing u-custom-text-active-color u-custom-text-color u-custom-text-hover-color u-custom-top-bottom-menu-spacing u-nav-link\" href=\"#\">\n          <svg class=\"u-svg-link\" preserveAspectRatio=\"xMidYMin slice\" viewBox=\"0 0 302 302\" style=\"\"><use xlink:href=\"#svg-8a8f\"></use></svg>\n          <svg xmlns=\"http://www.w3.org/2000/svg\" xmlns:xlink=\"http://www.w3.org/1999/xlink\" version=\"1.1\" id=\"svg-8a8f\" x=\"0px\" y=\"0px\" viewBox=\"0 0 302 302\" style=\"enable-background:new 0 0 302 302;\" xml:space=\"preserve\" class=\"u-svg-content\"><g><rect y=\"36\" width=\"302\" height=\"30\"></rect><rect y=\"236\" width=\"302\" height=\"30\"></rect><rect y=\"136\" width=\"302\" height=\"30\"></rect>\n</g><g></g><g></g><g></g><g></g><g></g><g></g><g></g><g></g><g></g><g></g><g></g><g></g><g></g><g></g><g></g></svg>\n        </a>\n      </div>\n      <div class=\"u-custom-menu u-nav-container\">\n        <ul class=\"u-nav u-spacing-20 u-unstyled u-block-5e76-23\"><li class=\"u-nav-item\"><a class=\"u-border-active-palette-1-base u-border-hover-palette-1-base u-button-style u-nav-link u-text-active-palette-1-base u-text-grey-90 u-text-hover-palette-2-base\" href=\"/Page-2.html\" data-page-id=\"278278\" style=\"padding: 10px;\">Page 2</a><div class=\"fake u-hidden u-nav-popup\"><ul class=\"u-h-spacing-20 u-nav u-unstyled u-v-spacing-10 u-block-5e76-24\"><li class=\"u-nav-item\"><a class=\"u-button-style u-nav-link u-white\" href=\"#\">Opción del menú1</a></li><li class=\"u-nav-item\"><a class=\"u-button-style u-nav-link u-white\" href=\"#\">Opción del menú2</a></li><li class=\"u-nav-item\"><a class=\"u-button-style u-nav-link u-white\" href=\"#\">Opción del menú3</a></li></ul></div></li><li class=\"u-nav-item\"><a class=\"u-border-active-palette-1-base u-border-hover-palette-1-base u-button-style u-nav-link u-text-active-palette-1-base u-text-grey-90 u-text-hover-palette-2-base\" style=\"padding: 10px;\">Test</a></li></ul>\n      </div>\n      <div class=\"u-custom-menu u-nav-container-collapse\">\n        <div class=\"u-align-center u-black u-container-style u-inner-container-layout u-opacity u-opacity-95 u-sidenav u-block-5e76-9\">\n          <div class=\"u-sidenav-overflow\">\n            <div class=\"u-menu-close u-block-5e76-10\"></div>\n            <ul class=\"u-align-center u-nav u-popupmenu-items u-unstyled u-block-5e76-11\"><li class=\"u-nav-item\"><a class=\"u-button-style u-nav-link\" href=\"/Page-2.html\" data-page-id=\"278278\" style=\"padding: 10px;\">Page 2</a><div class=\"fake u-hidden u-nav-popup\"><ul class=\"u-h-spacing-20 u-nav u-unstyled u-v-spacing-10 u-block-5e76-25\"><li class=\"u-nav-item\"><a class=\"u-button-style u-nav-link\" href=\"#\">Opción del menú1</a></li><li class=\"u-nav-item\"><a class=\"u-button-style u-nav-link\" href=\"#\">Opción del menú2</a></li><li class=\"u-nav-item\"><a class=\"u-button-style u-nav-link\" href=\"#\">Opción del menú3</a></li></ul></div></li><li class=\"u-nav-item\"><a class=\"u-button-style u-nav-link\" style=\"padding: 10px;\">Test</a></li></ul>\n          </div>\n        </div>\n        <div class=\"u-black u-menu-overlay u-opacity u-opacity-70\"></div>\n      </div>\n    </nav></div>\n  <style data-mode=\"XL\" data-visited=\"true\">@media (min-width: 1200px){ .u-block-5e76-1 {background-image: none}\n.u-block-5e76-2 {min-height: 72px; margin-top: 0px; margin-bottom: 0px; margin-left: auto; margin-right: auto}\n.u-block-5e76-3 {white-space: nowrap; height: 26px; min-height: 16px; width: 98px; min-width: 68px; margin-top: 20px; margin-right: 63px; margin-bottom: 0px; margin-left: auto}\n.u-block-5e76-20 {height: 100%; color: rgb(59, 89, 152) !important}\n.u-block-5e76-21 {height: 100%; color: rgb(85, 172, 238) !important}\n.u-block-5e76-22 {height: 100%; color: rgb(197, 54, 164) !important}\n.u-block-5e76-7 {margin-top: -30px; margin-right: 284px; margin-bottom: 20px; margin-left: auto}\n.u-block-5e76-23 {font-size: 1rem; letter-spacing: 0px; font-weight: 700}\n.u-block-5e76-24 {font-size: 1rem}\n.u-block-5e76-11 {font-size: 1rem}\n.u-block-5e76-25 {font-size: 1rem} }</style>\n  <style data-mode=\"LG\">@media (max-width: 1199px) and (min-width: 992px){ .u-block-5e76-1 {background-image: none}\n.u-block-5e76-2 {min-height: 72px; margin-top: 0px; margin-bottom: 0px; margin-left: auto; margin-right: auto}\n.u-block-5e76-3 {white-space: nowrap; height: 26px; min-height: 16px; width: 98px; min-width: 68px; margin-top: 20px; margin-right: NaNpx; margin-bottom: 0px; margin-left: auto}\n.u-block-5e76-20 {height: 100%; color: rgb(59, 89, 152) !important}\n.u-block-5e76-21 {height: 100%; color: rgb(85, 172, 238) !important}\n.u-block-5e76-22 {height: 100%; color: rgb(197, 54, 164) !important}\n.u-block-5e76-7 {margin-top: -30px; margin-left: auto; margin-right: auto; margin-bottom: 20px}\n.u-block-5e76-23 {font-size: 1rem; letter-spacing: 0px; font-weight: 700}\n.u-block-5e76-24 {font-size: 1rem}\n.u-block-5e76-11 {font-size: 1rem}\n.u-block-5e76-25 {font-size: 1rem} }</style>\n  <style data-mode=\"MD\">@media (max-width: 991px) and (min-width: 768px){ .u-block-5e76-1 {background-image: none}\n.u-block-5e76-2 {min-height: 72px; margin-top: 0px; margin-bottom: 0px; margin-left: auto; margin-right: auto}\n.u-block-5e76-3 {white-space: nowrap; height: 26px; min-height: 16px; width: 98px; min-width: 68px; margin-top: 20px; margin-right: NaNpx; margin-bottom: 0px; margin-left: auto}\n.u-block-5e76-20 {height: 100%; color: rgb(59, 89, 152) !important}\n.u-block-5e76-21 {height: 100%; color: rgb(85, 172, 238) !important}\n.u-block-5e76-22 {height: 100%; color: rgb(197, 54, 164) !important}\n.u-block-5e76-7 {margin-top: -30px; margin-left: auto; margin-right: auto; margin-bottom: 20px}\n.u-block-5e76-23 {font-size: 1rem; letter-spacing: 0px; font-weight: 700}\n.u-block-5e76-24 {font-size: 1rem}\n.u-block-5e76-11 {font-size: 1rem}\n.u-block-5e76-25 {font-size: 1rem} }</style>\n  <style data-mode=\"SM\" data-visited=\"true\">@media (max-width: 767px) and (min-width: 576px){ .u-block-5e76-1 {background-image: none}\n.u-block-5e76-2 {min-height: 61px; margin-top: 0px; margin-bottom: 0px; margin-left: auto; margin-right: auto}\n.u-block-5e76-3 {white-space: nowrap; height: 26px; min-height: 16px; width: 98px; min-width: 68px; margin-top: 17.5px; margin-right: 208px; margin-bottom: 0px; margin-left: auto}\n.u-block-5e76-20 {height: 100%; color: rgb(59, 89, 152) !important}\n.u-block-5e76-21 {height: 100%; color: rgb(85, 172, 238) !important}\n.u-block-5e76-22 {height: 100%; color: rgb(197, 54, 164) !important}\n.u-block-5e76-7 {width: auto; margin-top: -29px; margin-right: 0px; margin-bottom: 14.5px; margin-left: auto}\n.u-block-5e76-23 {font-size: 1rem; letter-spacing: 0px; font-weight: 700}\n.u-block-5e76-24 {font-size: 1rem}\n.u-block-5e76-11 {font-size: 1rem}\n.u-block-5e76-25 {font-size: 1rem} }</style>\n  <style data-mode=\"XS\" data-visited=\"true\">@media (max-width: 575px){ .u-block-5e76-1 {background-image: none}\n.u-block-5e76-2 {min-height: 63px; margin-top: 0px; margin-bottom: 0px; margin-left: auto; margin-right: auto}\n.u-block-5e76-3 {white-space: nowrap; height: 26px; min-height: 16px; width: 98px; min-width: 68px; margin-top: 17px; margin-left: auto; margin-right: auto; margin-bottom: 0px}\n.u-block-5e76-20 {height: 100%; color: rgb(59, 89, 152) !important}\n.u-block-5e76-21 {height: 100%; color: rgb(85, 172, 238) !important}\n.u-block-5e76-22 {height: 100%; color: rgb(197, 54, 164) !important}\n.u-block-5e76-7 {width: auto; margin-top: -41.75px; margin-right: 0px; margin-bottom: 29.75px; margin-left: auto}\n.u-block-5e76-23 {font-size: 1rem; letter-spacing: 0px; font-weight: 700}\n.u-block-5e76-24 {font-size: 1rem}\n.u-block-5e76-11 {font-size: 1rem}\n.u-block-5e76-25 {font-size: 1rem} }</style>\n</section>","footerHtml":"<section class=\"u-clearfix u-footer u-grey-80 u-block-cf84-1\" custom-posts-hash=\"[]\" data-style=\"footer-top-separator\" data-post-id=\"605169807\" data-section-properties=\"{&quot;grid-spacing&quot;:&quot;30&quot;,&quot;spacingAdditional&quot;:&quot;none&quot;,&quot;align&quot;:&quot;&quot;,&quot;stretch&quot;:true}\" id=\"sec-33eb\" data-source=\"\" data-id=\"cf84\">\n  <div class=\"u-clearfix u-sheet u-block-cf84-2\" data-state=\"{&quot;margin-top&quot;:{&quot;shouldApplyDefaultMargins&quot;:{&quot;XL&quot;:false,&quot;LG&quot;:false,&quot;MD&quot;:false,&quot;SM&quot;:false,&quot;XS&quot;:false},&quot;parentVerticalAlign&quot;:{&quot;XL&quot;:&quot;&quot;,&quot;LG&quot;:&quot;&quot;,&quot;MD&quot;:&quot;&quot;,&quot;SM&quot;:&quot;&quot;,&quot;XS&quot;:&quot;&quot;}},&quot;margin-bottom&quot;:{&quot;shouldApplyDefaultMargins&quot;:{&quot;XL&quot;:false,&quot;LG&quot;:false,&quot;MD&quot;:false,&quot;SM&quot;:false,&quot;XS&quot;:false},&quot;parentVerticalAlign&quot;:{&quot;XL&quot;:&quot;&quot;,&quot;LG&quot;:&quot;&quot;,&quot;MD&quot;:&quot;&quot;,&quot;SM&quot;:&quot;&quot;,&quot;XS&quot;:&quot;&quot;}}}\">\n    <div class=\"u-align-left u-social-icons u-spacing-10 u-block-cf84-4\" data-state=\"{&quot;height&quot;:{&quot;iconCount&quot;:{&quot;XL&quot;:3,&quot;LG&quot;:3,&quot;MD&quot;:3,&quot;SM&quot;:3,&quot;XS&quot;:3},&quot;iconSpacing&quot;:{&quot;XL&quot;:10,&quot;LG&quot;:10,&quot;MD&quot;:10,&quot;SM&quot;:10,&quot;XS&quot;:10}},&quot;margin-top&quot;:{&quot;shouldApplyDefaultMargins&quot;:{&quot;XL&quot;:false,&quot;LG&quot;:false,&quot;MD&quot;:false,&quot;SM&quot;:false,&quot;XS&quot;:false},&quot;parentVerticalAlign&quot;:{&quot;XL&quot;:&quot;&quot;,&quot;LG&quot;:&quot;&quot;,&quot;MD&quot;:&quot;&quot;,&quot;SM&quot;:&quot;&quot;,&quot;XS&quot;:&quot;&quot;}},&quot;margin-bottom&quot;:{&quot;shouldApplyDefaultMargins&quot;:{&quot;XL&quot;:false,&quot;LG&quot;:false,&quot;MD&quot;:false,&quot;SM&quot;:false,&quot;XS&quot;:false},&quot;parentVerticalAlign&quot;:{&quot;XL&quot;:&quot;&quot;,&quot;LG&quot;:&quot;&quot;,&quot;MD&quot;:&quot;&quot;,&quot;SM&quot;:&quot;&quot;,&quot;XS&quot;:&quot;&quot;}},&quot;min-height&quot;:{&quot;iconCount&quot;:{&quot;XL&quot;:3,&quot;LG&quot;:3,&quot;MD&quot;:3,&quot;SM&quot;:3,&quot;XS&quot;:3},&quot;iconSpacing&quot;:{&quot;XL&quot;:10,&quot;LG&quot;:10,&quot;MD&quot;:10,&quot;SM&quot;:10,&quot;XS&quot;:10}},&quot;min-width&quot;:{&quot;iconCount&quot;:{&quot;XL&quot;:3,&quot;LG&quot;:3,&quot;MD&quot;:3,&quot;SM&quot;:3,&quot;XS&quot;:3},&quot;iconSpacing&quot;:{&quot;XL&quot;:10,&quot;LG&quot;:10,&quot;MD&quot;:10,&quot;SM&quot;:10,&quot;XS&quot;:10}},&quot;width&quot;:{&quot;iconCount&quot;:{&quot;XL&quot;:3,&quot;LG&quot;:3,&quot;MD&quot;:3,&quot;SM&quot;:3,&quot;XS&quot;:3},&quot;iconSpacing&quot;:{&quot;XL&quot;:10,&quot;LG&quot;:10,&quot;MD&quot;:10,&quot;SM&quot;:10,&quot;XS&quot;:10}}}\"><a class=\"u-social-url\" title=\"Github\" target=\"_blank\" href=\"https://github.com/astrocronopio\"><span class=\"u-icon u-icon-circle u-social-icon u-social-twitter u-block-cf84-6\"><svg class=\"u-svg-link\" preserveAspectRatio=\"xMidYMin slice\" viewBox=\"0 0 512 512\" style=\"\"><use xlink:href=\"#svg-9c55\"></use></svg><svg xmlns=\"http://www.w3.org/2000/svg\" xmlns:xlink=\"http://www.w3.org/1999/xlink\" version=\"1.1\" xml:space=\"preserve\" class=\"u-svg-content\" viewBox=\"0 0 512 512\" id=\"svg-9c55\" data-color=\"rgb(85, 172, 238)\"><path d=\"m512 257c0 120-84.101562 220.5-196 247.5l-30.601562-97.199219h-58.796876l-29.601562 97.199219c-111.898438-27-197-127.5-197-247.5 0-140.699219 115.300781-257 256-257s256 116.300781 256 257zm0 0\" fill=\"#384949\"></path><path d=\"m512 257c0 120-84.101562 220.5-196 247.5l-30.601562-97.199219h-29.398438v-407.300781c140.699219 0 256 116.300781 256 257zm0 0\" fill=\"#293939\"></path><path d=\"m181.277344 430.058594c-6.078125 0-12.011719-.867188-17.828125-2.578125-15.128907-4.46875-27.421875-14.546875-36.546875-29.914063-4.160156-7.015625-8.496094-11.878906-13.605469-15.308594-5.027344-3.382812-9.039063-4.671874-13.273437-4.363281l-2.636719-29.882812c11.117187-.953125 21.753906 2.0625 32.59375 9.316406 8.832031 5.902344 16.257812 14.0625 22.71875 24.914063 5.304687 8.921874 11.410156 14.152343 19.25 16.46875 8.804687 2.589843 17.941406 1.507812 29.632812-3.472657l11.808594 27.566407c-11.296875 4.835937-21.929687 7.253906-32.113281 7.253906zm0 0\" fill=\"#ececf1\"></path><path d=\"m400.902344 287.300781c-10.503906 27.898438-36.902344 63.300781-103.800782 73.199219 8.699219 12.898438 19.199219 19.800781 18.898438 46.800781v97.199219c-19.199219 4.800781-39.300781 7.5-60 7.5s-39.800781-2.699219-59-7.5v-98.402344c0-26.699218 10.101562-34.199218 17.898438-45.597656-66.898438-9.902344-93.296876-45.300781-103.800782-73.199219-14.097656-37.203125-6.597656-83.402343 18.003906-112.800781.597657-.601562 1.5-2.101562 1.199219-3-11.402343-34.199219 2.398438-62.699219 3-65.699219 12.898438 3.898438 15-3.902343 56.699219 21.597657l7.199219 4.203124c3 1.796876 2.101562.597657 5.101562.597657 17.398438-4.800781 35.699219-7.5 53.699219-7.5 18.300781 0 36.300781 2.699219 54.597656 7.5l2.101563.300781s.597656 0 2.101562-.898438c51.898438-31.503906 50.097657-21.300781 64.195313-25.800781.300781 3 14.101562 31.796875 2.703125 65.699219-1.5 4.5 45 47.097656 19.203125 115.800781zm0 0\" fill=\"#ececf1\"></path><path d=\"m400.902344 287.300781c-10.503906 27.898438-36.902344 63.300781-103.800782 73.199219 8.699219 12.898438 19.199219 19.800781 18.898438 46.800781v97.199219c-19.199219 4.800781-39.300781 7.5-60 7.5v-387.300781c18.300781 0 36.300781 2.699219 54.601562 7.5l2.097657.300781s.601562 0 2.101562-.898438c51.898438-31.503906 50.097657-21.300781 64.199219-25.800781.300781 3 14.101562 31.796875 2.699219 65.699219-1.5 4.5 45 47.097656 19.203125 115.800781zm0 0\" fill=\"#e2e2e7\"></path></svg></span></a><a class=\"u-social-url\" title=\"linkedin\" target=\"_blank\" href=\"linkedin.com/in/evelyn-coronel/\"><span class=\"u-icon u-icon-circle u-social-icon u-social-linkedin u-block-cf84-8\"><svg class=\"u-svg-link\" preserveAspectRatio=\"xMidYMin slice\" viewBox=\"0 0 112 112\" style=\"\"><use xlink:href=\"#svg-022d\"></use></svg><svg xmlns=\"http://www.w3.org/2000/svg\" xmlns:xlink=\"http://www.w3.org/1999/xlink\" version=\"1.1\" xml:space=\"preserve\" class=\"u-svg-content\" viewBox=\"0 0 112 112\" x=\"0\" y=\"0\" id=\"svg-022d\" data-color=\"#007ab9\"><circle fill=\"currentColor\" cx=\"56.1\" cy=\"56.1\" r=\"55\"></circle><path fill=\"#FFFFFF\" d=\"M41.3,83.7H27.9V43.4h13.4V83.7z M34.6,37.9L34.6,37.9c-4.6,0-7.5-3.1-7.5-7c0-4,3-7,7.6-7s7.4,3,7.5,7\n            C42.2,34.8,39.2,37.9,34.6,37.9z M89.6,83.7H76.2V62.2c0-5.4-1.9-9.1-6.8-9.1c-3.7,0-5.9,2.5-6.9,4.9c-0.4,0.9-0.4,2.1-0.4,3.3v22.5\n            H48.7c0,0,0.2-36.5,0-40.3h13.4v5.7c1.8-2.7,5-6.7,12.1-6.7c8.8,0,15.4,5.8,15.4,18.1V83.7z\"></path></svg></span></a><a class=\"u-social-url\" target=\"_blank\" title=\"Email\" href=\"mailto:evelyngabrielacoronel@gmail.com\"><span class=\"u-icon u-icon-circle u-social-icon u-social-instagram u-block-cf84-9\"><svg class=\"u-svg-link\" preserveAspectRatio=\"xMidYMin slice\" viewBox=\"0 0 482 482\" style=\"\"><use xlink:href=\"#svg-9b61\"></use></svg><svg xmlns=\"http://www.w3.org/2000/svg\" xmlns:xlink=\"http://www.w3.org/1999/xlink\" version=\"1.1\" xml:space=\"preserve\" class=\"u-svg-content\" viewBox=\"0 0 482 482\" id=\"svg-9b61\" data-color=\"rgb(197, 54, 164)\"><path d=\"m481.8 198.889v204.882c0 29.214-23.767 52.981-52.98 52.981h-375.839c-29.214 0-52.981-23.768-52.981-52.981v-263.887c0-29.214 23.767-52.981 52.981-52.981h233.019c4.971 0 9 4.029 9 9s-4.029 9-9 9h-233.019c-19.289 0-34.981 15.693-34.981 34.981v26.83l205.871 99.978c10.824 5.255 23.24 5.258 34.063.005l100.597-48.815c4.474-2.168 9.856-.304 12.025 4.168 2.17 4.472.305 9.856-4.168 12.026l-100.596 48.815c-15.814 7.675-33.959 7.677-49.784-.008l-198.008-96.159v217.047c0 19.289 15.692 34.981 34.981 34.981h375.838c19.288 0 34.98-15.692 34.98-34.981v-204.882c0-4.971 4.029-9 9-9s9.001 4.029 9.001 9zm-341.223 104.558-87.712 87.712c-5.687 5.687-1.581 15.364 6.364 15.364 2.303 0 4.606-.879 6.364-2.636l87.712-87.712c3.515-3.515 3.515-9.213 0-12.728-3.515-3.514-9.214-3.514-12.728 0zm187.918 0c-3.515 3.515-3.515 9.213 0 12.728l87.712 87.712c1.758 1.757 4.061 2.636 6.364 2.636 7.946 0 12.051-9.677 6.364-15.364l-87.712-87.712c-3.515-3.514-9.212-3.514-12.728 0zm153.505-198.262v13.855c0 27.122-35.006 38.448-50.832 16.177-26.507 25.63-71.168 6.868-71.168-30.176 0-23.159 18.841-42 42-42s42 18.841 42 42v14c0 5.514 4.486 10 10 10s10-4.486 10-10c0-15.898 2.046-37.906-18.639-58.109-38.165-37.276-103.772-11.717-105.055 42.757-.819 34.832 27.094 63.352 61.838 63.352 4.971 0 9 4.029 9 9s-4.029 9-9 9c-44.89 0-80.891-36.857-79.832-81.776 1.611-68.473 85.245-104.42 135.626-55.21 15.517 15.155 24.062 35.444 24.062 57.13zm-56-.144c0-13.234-10.767-24-24-24s-24 10.766-24 24 10.767 24 24 24 24-10.766 24-24z\"></path></svg></span></a></div>\n  </div>\n  <style data-mode=\"XL\" data-visited=\"true\">@media (min-width: 1200px){ .u-block-cf84-2 {min-height: 120px}\n.u-block-cf84-4 {height: 32px; min-height: 16px; width: 116px; min-width: 68px; white-space: nowrap; margin-top: 44px; margin-bottom: 44px; margin-left: auto; margin-right: auto}\n.u-block-cf84-6 {height: 100%; color: rgb(85, 172, 238) !important}\n.u-block-cf84-8 {height: 100%; color: rgb(0, 122, 185) !important}\n.u-block-cf84-9 {height: 100%; color: rgb(197, 54, 164) !important} }</style>\n  <style data-mode=\"LG\">@media (max-width: 1199px) and (min-width: 992px){ .u-block-cf84-2 {min-height: 99px}\n.u-block-cf84-4 {height: 32px; min-height: 16px; width: 116px; min-width: 68px; white-space: nowrap; margin-top: 44px; margin-bottom: 44px; margin-left: auto; margin-right: auto}\n.u-block-cf84-6 {height: 100%; color: rgb(85, 172, 238) !important}\n.u-block-cf84-8 {height: 100%; color: rgb(0, 122, 185) !important}\n.u-block-cf84-9 {height: 100%; color: rgb(197, 54, 164) !important} }</style>\n  <style data-mode=\"MD\">@media (max-width: 991px) and (min-width: 768px){ .u-block-cf84-2 {min-height: 76px}\n.u-block-cf84-4 {height: 32px; min-height: 16px; width: 116px; min-width: 68px; white-space: nowrap; margin-top: 44px; margin-bottom: 44px; margin-left: auto; margin-right: auto}\n.u-block-cf84-6 {height: 100%; color: rgb(85, 172, 238) !important}\n.u-block-cf84-8 {height: 100%; color: rgb(0, 122, 185) !important}\n.u-block-cf84-9 {height: 100%; color: rgb(197, 54, 164) !important} }</style>\n  <style data-mode=\"SM\">@media (max-width: 767px) and (min-width: 576px){ .u-block-cf84-2 {min-height: 57px}\n.u-block-cf84-4 {height: 32px; min-height: 16px; width: 116px; min-width: 68px; white-space: nowrap; margin-top: 44px; margin-bottom: 44px; margin-left: auto; margin-right: auto}\n.u-block-cf84-6 {height: 100%; color: rgb(85, 172, 238) !important}\n.u-block-cf84-8 {height: 100%; color: rgb(0, 122, 185) !important}\n.u-block-cf84-9 {height: 100%; color: rgb(197, 54, 164) !important} }</style>\n  <style data-mode=\"XS\">@media (max-width: 575px){ .u-block-cf84-2 {min-height: 36px}\n.u-block-cf84-4 {height: 32px; min-height: 16px; width: 116px; min-width: 68px; white-space: nowrap; margin-top: 44px; margin-bottom: 44px; margin-left: auto; margin-right: auto}\n.u-block-cf84-6 {height: 100%; color: rgb(85, 172, 238) !important}\n.u-block-cf84-8 {height: 100%; color: rgb(0, 122, 185) !important}\n.u-block-cf84-9 {height: 100%; color: rgb(197, 54, 164) !important} }</style>\n</section>","hideBacklink":null,"homePageId":278278,"dateUpdated":1617231989127,"settings":"{\"id\":0,\"colorScheme\":{\"bodyColors\":[\"#111111\",\"#ffffff\"],\"bgColor\":\"#ffffff\",\"colors\":[\"#28cad9\",\"#f0005f\",\"#ff8e02\",\"#eb5234\",\"#b9c1cc\"],\"customColors\":[{\"color\":\"#580101\",\"status\":0,\"transparency\":1}],\"shadingContrast\":\"body-alt-color\",\"whiteContrast\":\"body-color\",\"bgContrast\":\"body-color\",\"name\":\"u10\"},\"fontScheme\":{\"name\":\"Roboto-OpenSans\",\"default\":true,\"isDefault\":true,\"fonts\":{\"heading\":\"Roboto, sans-serif\",\"text\":\"Open Sans, sans-serif\",\"accent\":\"Arial, sans-serif\",\"headingTitle\":\"Roboto\",\"textTitle\":\"Open Sans\"}},\"typography\":{\"name\":\"Normal\",\"isDefault\":true,\"title\":{\"font-weight\":\"400\",\"font-size\":4.5,\"line-height\":\"1_1\",\"margin-top\":20,\"margin-bottom\":20,\"SM\":{\"font-size\":3.75},\"XS\":{\"font-size\":3}},\"subtitle\":{\"font-weight\":\"400\",\"font-size\":2.25,\"line-height\":\"1_1\",\"margin-top\":20,\"margin-bottom\":20,\"XS\":{\"font-size\":1.5}},\"h1\":{\"font-weight\":\"400\",\"font-size\":3,\"line-height\":\"1_1\",\"margin-top\":20,\"margin-bottom\":20,\"XS\":{\"font-size\":2.25}},\"h2\":{\"font-weight\":\"400\",\"font-size\":2.25,\"line-height\":\"1_1\",\"margin-top\":20,\"margin-bottom\":20,\"XS\":{\"font-size\":1.5}},\"h3\":{\"font-weight\":\"400\",\"font-size\":1.875,\"line-height\":\"1_2\",\"margin-top\":20,\"margin-bottom\":20,\"XS\":{\"font-size\":1.5}},\"h4\":{\"font-weight\":\"400\",\"font-size\":1.5,\"line-height\":\"1_2\",\"margin-top\":20,\"margin-bottom\":20},\"h5\":{\"font-weight\":\"400\",\"font-size\":1.25,\"line-height\":\"1_2\",\"margin-top\":20,\"margin-bottom\":20},\"h6\":{\"font-weight\":\"400\",\"font-size\":1.125,\"line-height\":\"1_2\",\"margin-top\":20,\"margin-bottom\":20},\"largeText\":{\"font-size\":1.25,\"margin-top\":20,\"margin-bottom\":20},\"smallText\":{\"font-size\":0.875,\"margin-top\":20,\"margin-bottom\":20},\"text\":{\"margin-top\":20,\"margin-bottom\":20},\"hyperlink\":{\"text-color\":\"palette-1-base\"},\"link\":{},\"button\":{\"color\":\"palette-1-base\",\"margin-top\":20,\"margin-bottom\":20},\"blockquote\":{\"font-style\":\"italic\",\"indent\":20,\"border\":4,\"border-color\":\"palette-1-base\",\"margin-top\":20,\"margin-bottom\":20},\"metadata\":{\"margin-top\":20,\"margin-bottom\":20},\"list\":{\"margin-top\":20,\"margin-bottom\":20},\"orderedlist\":{\"margin-top\":20,\"margin-bottom\":20},\"postContent\":{\"margin-top\":20,\"margin-bottom\":20},\"theme\":{\"gradient\":\"\",\"image\":\"\"},\"htmlBaseSize\":16},\"backToTop\":\"<span style=\\\"height: 64px; width: 64px; margin-left: 0px; margin-right: auto; margin-top: 0px; background-image: none; right: 20px; bottom: 20px\\\" class=\\\"u-back-to-top u-icon u-icon-circle u-opacity u-opacity-85 u-palette-1-base u-spacing-15\\\" data-href=\\\"#\\\"><svg class=\\\"u-svg-link\\\" preserveAspectRatio=\\\"xMidYMin slice\\\" viewBox=\\\"0 0 551.13 551.13\\\" style=\\\"\\\"><use xlink:href=\\\"#svg-cb45\\\"></use></svg><svg xmlns=\\\"http://www.w3.org/2000/svg\\\" xmlns:xlink=\\\"http://www.w3.org/1999/xlink\\\" version=\\\"1.1\\\" xml:space=\\\"preserve\\\" class=\\\"u-svg-content\\\" viewBox=\\\"0 0 551.13 551.13\\\" id=\\\"svg-cb45\\\"><path d=\\\"m275.565 189.451 223.897 223.897h51.668l-275.565-275.565-275.565 275.565h51.668z\\\"></path></svg>\\n        \\n        \\n    </span>\",\"cookiesSection\":\"<section class=\\\"u-align-center u-block-0bd6-1 u-clearfix u-cookies-consent u-grey-80\\\" custom-posts-hash=\\\"T\\\" style=\\\"background-image: none\\\" data-post-id=\\\"1\\\" data-section-properties=\\\"{&quot;stretch&quot;:true}\\\" data-id=\\\"0bd6\\\" data-posts-content=\\\"[{'images':[],'maps':[],'videos':[],'icons':[],'textWidth':874,'textHeight':152,'id':1,'headingProp':'h3','textProp':'text'}]\\\" data-style=\\\"cookie-1\\\" id=\\\"sec-8ba5\\\" data-source=\\\"\\\">\\n  <div class=\\\"u-block-0bd6-2 u-clearfix u-sheet u-valign-middle\\\" style=\\\"min-height: 212px\\\" data-state=\\\"{&quot;margin-top&quot;:{&quot;shouldApplyDefaultMargins&quot;:{&quot;XL&quot;:false,&quot;LG&quot;:false,&quot;MD&quot;:false,&quot;SM&quot;:false,&quot;XS&quot;:false},&quot;parentVerticalAlign&quot;:{&quot;XL&quot;:&quot;middle&quot;,&quot;LG&quot;:&quot;middle&quot;,&quot;MD&quot;:&quot;middle&quot;,&quot;SM&quot;:&quot;middle&quot;,&quot;XS&quot;:&quot;middle&quot;}},&quot;margin-bottom&quot;:{&quot;shouldApplyDefaultMargins&quot;:{&quot;XL&quot;:false,&quot;LG&quot;:false,&quot;MD&quot;:false,&quot;SM&quot;:false,&quot;XS&quot;:false},&quot;parentVerticalAlign&quot;:{&quot;XL&quot;:&quot;middle&quot;,&quot;LG&quot;:&quot;middle&quot;,&quot;MD&quot;:&quot;middle&quot;,&quot;SM&quot;:&quot;middle&quot;,&quot;XS&quot;:&quot;middle&quot;}}}\\\" data-height-lg=\\\"158\\\" data-height-md=\\\"131\\\" data-height-sm=\\\"106\\\" data-height-xs=\\\"225\\\">\\n    <div class=\\\"u-block-0bd6-7 u-clearfix u-expanded-width u-layout-wrap\\\" style=\\\"margin-top: 30px; margin-bottom: 30px\\\" data-state=\\\"{&quot;margin-top&quot;:{&quot;shouldApplyDefaultMargins&quot;:{&quot;XL&quot;:false,&quot;LG&quot;:false,&quot;MD&quot;:false,&quot;SM&quot;:false,&quot;XS&quot;:false},&quot;parentVerticalAlign&quot;:{&quot;XL&quot;:&quot;middle&quot;,&quot;LG&quot;:&quot;middle&quot;,&quot;MD&quot;:&quot;middle&quot;,&quot;SM&quot;:&quot;middle&quot;,&quot;XS&quot;:&quot;middle&quot;}},&quot;margin-bottom&quot;:{&quot;shouldApplyDefaultMargins&quot;:{&quot;XL&quot;:false,&quot;LG&quot;:false,&quot;MD&quot;:false,&quot;SM&quot;:false,&quot;XS&quot;:false},&quot;parentVerticalAlign&quot;:{&quot;XL&quot;:&quot;middle&quot;,&quot;LG&quot;:&quot;middle&quot;,&quot;MD&quot;:&quot;middle&quot;,&quot;SM&quot;:&quot;middle&quot;,&quot;XS&quot;:&quot;middle&quot;}}}\\\">\\n      <div class=\\\"u-gutter-0 u-layout\\\">\\n        <div class=\\\"u-layout-row\\\">\\n          <div class=\\\"u-block-0bd6-8 u-container-style u-layout-cell u-left-cell u-size-43-md u-size-43-sm u-size-43-xs u-size-46-lg u-size-46-xl\\\" style=\\\"min-height: 152px\\\" data-state=\\\"{&quot;min-height&quot;:{&quot;expandedParent&quot;:{&quot;XL&quot;:true,&quot;LG&quot;:true,&quot;MD&quot;:true,&quot;SM&quot;:true,&quot;XS&quot;:true},&quot;cellMultiplier&quot;:{&quot;XL&quot;:1,&quot;LG&quot;:1,&quot;MD&quot;:0.9347826086956521,&quot;SM&quot;:1.3953488372093024,&quot;XS&quot;:1},&quot;canCollapse&quot;:{&quot;XL&quot;:false,&quot;LG&quot;:false,&quot;MD&quot;:true,&quot;SM&quot;:true,&quot;XS&quot;:true}}}\\\">\\n            <div class=\\\"u-block-0bd6-9 u-container-layout u-valign-middle\\\" style=\\\"padding-top: 30px; padding-bottom: 30px; padding-left: 60px; padding-right: 60px\\\" data-state=\\\"{&quot;min-height&quot;:{&quot;canCollapse&quot;:{&quot;XL&quot;:false,&quot;LG&quot;:false,&quot;MD&quot;:false,&quot;SM&quot;:false,&quot;XS&quot;:false}}}\\\">\\n              <h3 class=\\\"u-block-0bd6-6 u-text u-text-default\\\" style=\\\"margin-top: 0px; margin-right: 20px; margin-bottom: 0px;\\\">Cookies &amp; Privacy</h3>\\n              <p class=\\\"u-block-0bd6-5 u-text u-text-default\\\" style=\\\"margin: 8px 20px 0px 0px;\\\">This website uses cookies to ensure you get the best experience on our website.</p>\\n            </div>\\n          </div>\\n          <div class=\\\"u-align-left u-block-0bd6-10 u-container-style u-layout-cell u-right-cell u-size-14-lg u-size-14-xl u-size-17-md u-size-17-sm u-size-17-xs\\\" style=\\\"min-height: 152px\\\" data-state=\\\"{&quot;min-height&quot;:{&quot;expandedParent&quot;:{&quot;XL&quot;:true,&quot;LG&quot;:true,&quot;MD&quot;:true,&quot;SM&quot;:true,&quot;XS&quot;:true},&quot;cellMultiplier&quot;:{&quot;XL&quot;:1,&quot;LG&quot;:1,&quot;MD&quot;:1.2142857142857142,&quot;SM&quot;:3.5294117647058822,&quot;XS&quot;:1},&quot;canCollapse&quot;:{&quot;XL&quot;:false,&quot;LG&quot;:false,&quot;MD&quot;:true,&quot;SM&quot;:true,&quot;XS&quot;:true}}}\\\">\\n            <div class=\\\"u-block-0bd6-11 u-container-layout u-valign-middle-lg u-valign-middle-md u-valign-middle-xl u-valign-top-sm u-valign-top-xs\\\" style=\\\"padding-top: 30px; padding-bottom: 30px; padding-left: 30px; padding-right: 30px\\\" data-state=\\\"{&quot;min-height&quot;:{&quot;canCollapse&quot;:{&quot;XL&quot;:false,&quot;LG&quot;:false,&quot;MD&quot;:false,&quot;SM&quot;:false,&quot;XS&quot;:false}}}\\\">\\n              <a href=\\\"###\\\" class=\\\"u-block-0bd6-3 u-btn u-button-confirm u-button-style u-palette-1-base\\\" style=\\\"margin-top: 0px; margin-right: auto; margin-bottom: 0px; margin-left: 0px\\\">Confirm</a>\\n            </div>\\n          </div>\\n        </div>\\n      </div>\\n    </div>\\n  </div>\\n  <style data-mode=\\\"XL\\\">@media (max-width: 0px) { .u-block-0bd6-1 {background-image: none}\\n.u-block-0bd6-2 {min-height: 212px}\\n.u-block-0bd6-7 {margin-top: 30px; margin-bottom: 30px}\\n.u-block-0bd6-8 {min-height: 152px}\\n.u-block-0bd6-9 {padding-top: 30px; padding-bottom: 30px; padding-left: 60px; padding-right: 60px}\\n.u-block-0bd6-6 {margin-top: 0px; margin-right: 20px; margin-bottom: 0px}\\n.u-block-0bd6-5 {margin-top: 8px; margin-right: 20px; margin-bottom: 0px; margin-left: 0px}\\n.u-block-0bd6-10 {min-height: 152px}\\n.u-block-0bd6-11 {padding-top: 30px; padding-bottom: 30px; padding-left: 30px; padding-right: 30px}\\n.u-block-0bd6-3 {margin-top: 0px; margin-right: auto; margin-bottom: 0px; margin-left: 0px} }</style>\\n  <style data-mode=\\\"LG\\\">@media (max-width: 0px) { .u-block-0bd6-1 {background-image: none}\\n.u-block-0bd6-2 {min-height: 131px}\\n.u-block-0bd6-7 {margin-top: 30px; margin-bottom: 30px}\\n.u-block-0bd6-8 {min-height: 125px}\\n.u-block-0bd6-9 {padding-top: 30px; padding-bottom: 30px; padding-left: 60px; padding-right: 60px}\\n.u-block-0bd6-6 {margin-top: 0px; margin-right: 0px; margin-bottom: 0px}\\n.u-block-0bd6-5 {margin-top: 8px; margin-right: 0px; margin-bottom: 0px; margin-left: 0px}\\n.u-block-0bd6-10 {min-height: 125px}\\n.u-block-0bd6-11 {padding-top: 30px; padding-bottom: 30px; padding-left: 30px; padding-right: 30px}\\n.u-block-0bd6-3 {margin-top: 0px; margin-right: auto; margin-bottom: 0px; margin-left: 0px} }</style>\\n  <style data-mode=\\\"MD\\\" data-visited=\\\"true\\\">@media (max-width: 0px) { .u-block-0bd6-1 {background-image: none}\\n.u-block-0bd6-2 {min-height: 106px}\\n.u-block-0bd6-7 {margin-top: 30px; margin-bottom: 30px}\\n.u-block-0bd6-8 {min-height: 100px}\\n.u-block-0bd6-9 {padding-top: 30px; padding-bottom: 30px; padding-left: 30px; padding-right: 30px}\\n.u-block-0bd6-6 {margin-top: 0px; margin-right: 0px; margin-bottom: 0px}\\n.u-block-0bd6-5 {margin-top: 8px; margin-right: 0px; margin-bottom: 0px; margin-left: 0px}\\n.u-block-0bd6-10 {min-height: 100px}\\n.u-block-0bd6-11 {padding-top: 30px; padding-bottom: 30px; padding-left: 30px; padding-right: 30px}\\n.u-block-0bd6-3 {margin-top: 0px; margin-right: auto; margin-bottom: 0px; margin-left: 0px} }</style>\\n  <style data-mode=\\\"SM\\\" data-visited=\\\"true\\\">@media (max-width: 0px) { .u-block-0bd6-1 {background-image: none}\\n.u-block-0bd6-2 {min-height: 225px}\\n.u-block-0bd6-7 {margin-top: 30px; margin-bottom: 30px}\\n.u-block-0bd6-8 {min-height: 154px}\\n.u-block-0bd6-9 {padding-top: 30px; padding-left: 10px; padding-right: 10px; padding-bottom: 20px}\\n.u-block-0bd6-6 {margin-top: 0px; margin-right: 0px; margin-bottom: 0px}\\n.u-block-0bd6-5 {margin-top: 8px; margin-right: 0px; margin-bottom: 0px; margin-left: 0px}\\n.u-block-0bd6-10 {min-height: 65px}\\n.u-block-0bd6-11 {padding-top: 10px; padding-bottom: 10px; padding-left: 10px; padding-right: 10px}\\n.u-block-0bd6-3 {margin-top: 0px; margin-right: auto; margin-bottom: 0px; margin-left: 0px} }</style>\\n  <style data-mode=\\\"XS\\\" data-visited=\\\"true\\\">@media (max-width: 0px) { .u-block-0bd6-1 {background-image: none}\\n.u-block-0bd6-2 {min-height: 121px}\\n.u-block-0bd6-7 {margin-top: 30px; margin-bottom: 30px}\\n.u-block-0bd6-8 {min-height: 100px}\\n.u-block-0bd6-9 {padding-top: 30px; padding-bottom: 20px; padding-left: 10px; padding-right: 10px}\\n.u-block-0bd6-6 {margin-top: 0px; margin-right: 0px; margin-bottom: 0px}\\n.u-block-0bd6-5 {margin-top: 8px; margin-right: 0px; margin-bottom: 0px; margin-left: 0px}\\n.u-block-0bd6-10 {min-height: 15px}\\n.u-block-0bd6-11 {padding-top: 10px; padding-bottom: 10px; padding-left: 10px; padding-right: 10px}\\n.u-block-0bd6-3 {margin-top: 0px; margin-right: auto; margin-bottom: 0px; margin-left: 0px} }</style>\\n</section>\",\"themeBackLinks\":\"\",\"blog\":\"{\\\"posts\\\":{\\\"items\\\":[]}}\"}","dialog":null,"title":"WebSite278277","siteStyleCss":"<style id=\"color-scheme\" color-scheme=\"u10\" color-style=\"multicolor-1\">.u-body {\n--none: transparent;\n--none-darker: transparent;\n--none-r: 255;\n--none-g: 255;\n--none-b: 255;\n--none-contrast: body-color;\n--none-contrast-darker: body-color;\n--none-text-color: var(--body-color);\n--custom-color-1: #580101;\n--custom-color-1-darker: #4f0101;\n--custom-color-1-r: 88;\n--custom-color-1-g: 1;\n--custom-color-1-b: 1;\n--custom-color-1-contrast: white;\n--custom-color-1-contrast-darker: white;\n--custom-color-1-text-color: var(--body-alt-color);\n--body-color: #111111;\n--body-color-darker: #0f0f0f;\n--body-color-r: 17;\n--body-color-g: 17;\n--body-color-b: 17;\n--body-color-contrast: white;\n--body-color-contrast-darker: white;\n--body-color-text-color: var(--body-alt-color);\n--body-alt-color: #ffffff;\n--body-alt-color-darker: #e6e6e6;\n--body-alt-color-r: 255;\n--body-alt-color-g: 255;\n--body-alt-color-b: 255;\n--body-alt-color-contrast: black;\n--body-alt-color-contrast-darker: black;\n--body-alt-color-text-color: var(--body-color);\n--bg-color: #ffffff;\n--bg-color-darker: #e6e6e6;\n--bg-color-r: 255;\n--bg-color-g: 255;\n--bg-color-b: 255;\n--bg-color-contrast: black;\n--bg-color-contrast-darker: black;\n--bg-color-text-color: var(--body-color);\n--palette-1-base: #28cad9;\n--palette-1-base-darker: #23b7c5;\n--palette-1-base-r: 40;\n--palette-1-base-g: 202;\n--palette-1-base-b: 217;\n--palette-1-base-contrast: white;\n--palette-1-base-contrast-darker: white;\n--palette-1-base-text-color: var(--body-alt-color);\n--palette-1-dark-3: #293233;\n--palette-1-dark-3-darker: #252d2e;\n--palette-1-dark-3-r: 41;\n--palette-1-dark-3-g: 50;\n--palette-1-dark-3-b: 51;\n--palette-1-dark-3-contrast: white;\n--palette-1-dark-3-contrast-darker: white;\n--palette-1-dark-3-text-color: var(--body-alt-color);\n--palette-1-dark-2: #3f676a;\n--palette-1-dark-2-darker: #395d5f;\n--palette-1-dark-2-r: 63;\n--palette-1-dark-2-g: 103;\n--palette-1-dark-2-b: 106;\n--palette-1-dark-2-contrast: white;\n--palette-1-dark-2-contrast-darker: white;\n--palette-1-dark-2-text-color: var(--body-alt-color);\n--palette-1-dark-1: #3f99a2;\n--palette-1-dark-1-darker: #398a92;\n--palette-1-dark-1-r: 63;\n--palette-1-dark-1-g: 153;\n--palette-1-dark-1-b: 162;\n--palette-1-dark-1-contrast: white;\n--palette-1-dark-1-contrast-darker: white;\n--palette-1-dark-1-text-color: var(--body-alt-color);\n--palette-1: #28cad9;\n--palette-1-darker: #23b7c5;\n--palette-1-r: 40;\n--palette-1-g: 202;\n--palette-1-b: 217;\n--palette-1-contrast: white;\n--palette-1-contrast-darker: white;\n--palette-1-text-color: var(--body-alt-color);\n--palette-1-light-1: #62d9e4;\n--palette-1-light-1-darker: #46d2df;\n--palette-1-light-1-r: 98;\n--palette-1-light-1-g: 217;\n--palette-1-light-1-b: 228;\n--palette-1-light-1-contrast: black;\n--palette-1-light-1-contrast-darker: black;\n--palette-1-light-1-text-color: var(--body-color);\n--palette-1-light-2: #a2e9f0;\n--palette-1-light-2-darker: #7fe1ea;\n--palette-1-light-2-r: 162;\n--palette-1-light-2-g: 233;\n--palette-1-light-2-b: 240;\n--palette-1-light-2-contrast: black;\n--palette-1-light-2-contrast-darker: black;\n--palette-1-light-2-text-color: var(--body-color);\n--palette-1-light-3: #e7f9fb;\n--palette-1-light-3-darker: #beeff4;\n--palette-1-light-3-r: 231;\n--palette-1-light-3-g: 249;\n--palette-1-light-3-b: 251;\n--palette-1-light-3-contrast: black;\n--palette-1-light-3-contrast-darker: black;\n--palette-1-light-3-text-color: var(--body-color);\n--palette-2-base: #f0005f;\n--palette-2-base-darker: #d80055;\n--palette-2-base-r: 240;\n--palette-2-base-g: 0;\n--palette-2-base-b: 95;\n--palette-2-base-contrast: white;\n--palette-2-base-contrast-darker: white;\n--palette-2-base-text-color: var(--body-alt-color);\n--palette-2-dark-3: #33292d;\n--palette-2-dark-3-darker: #2e2529;\n--palette-2-dark-3-r: 51;\n--palette-2-dark-3-g: 41;\n--palette-2-dark-3-b: 45;\n--palette-2-dark-3-contrast: white;\n--palette-2-dark-3-contrast-darker: white;\n--palette-2-dark-3-text-color: var(--body-alt-color);\n--palette-2-dark-2: #723d52;\n--palette-2-dark-2-darker: #67374a;\n--palette-2-dark-2-r: 114;\n--palette-2-dark-2-g: 61;\n--palette-2-dark-2-b: 82;\n--palette-2-dark-2-contrast: white;\n--palette-2-dark-2-contrast-darker: white;\n--palette-2-dark-2-text-color: var(--body-alt-color);\n--palette-2-dark-1: #b12f63;\n--palette-2-dark-1-darker: #9f2a59;\n--palette-2-dark-1-r: 177;\n--palette-2-dark-1-g: 47;\n--palette-2-dark-1-b: 99;\n--palette-2-dark-1-contrast: white;\n--palette-2-dark-1-contrast-darker: white;\n--palette-2-dark-1-text-color: var(--body-alt-color);\n--palette-2: #f0005f;\n--palette-2-darker: #d80055;\n--palette-2-r: 240;\n--palette-2-g: 0;\n--palette-2-b: 95;\n--palette-2-contrast: white;\n--palette-2-contrast-darker: white;\n--palette-2-text-color: var(--body-alt-color);\n--palette-2-light-1: #f5498d;\n--palette-2-light-1-darker: #f32b7a;\n--palette-2-light-1-r: 245;\n--palette-2-light-1-g: 73;\n--palette-2-light-1-b: 141;\n--palette-2-light-1-contrast: white;\n--palette-2-light-1-contrast-darker: white;\n--palette-2-light-1-text-color: var(--body-alt-color);\n--palette-2-light-2: #f995bd;\n--palette-2-light-2-darker: #f76fa6;\n--palette-2-light-2-r: 249;\n--palette-2-light-2-g: 149;\n--palette-2-light-2-b: 189;\n--palette-2-light-2-contrast: white;\n--palette-2-light-2-contrast-darker: white;\n--palette-2-light-2-text-color: var(--body-alt-color);\n--palette-2-light-3: #fee4ee;\n--palette-2-light-3-darker: #fcb6d1;\n--palette-2-light-3-r: 254;\n--palette-2-light-3-g: 228;\n--palette-2-light-3-b: 238;\n--palette-2-light-3-contrast: black;\n--palette-2-light-3-contrast-darker: black;\n--palette-2-light-3-text-color: var(--body-color);\n--palette-3-base: #ff8e02;\n--palette-3-base-darker: #e78000;\n--palette-3-base-r: 255;\n--palette-3-base-g: 142;\n--palette-3-base-b: 2;\n--palette-3-base-contrast: white;\n--palette-3-base-contrast-darker: white;\n--palette-3-base-text-color: var(--body-alt-color);\n--palette-3-dark-3: #332e29;\n--palette-3-dark-3-darker: #2e2925;\n--palette-3-dark-3-r: 51;\n--palette-3-dark-3-g: 46;\n--palette-3-dark-3-b: 41;\n--palette-3-dark-3-contrast: white;\n--palette-3-dark-3-contrast-darker: white;\n--palette-3-dark-3-text-color: var(--body-alt-color);\n--palette-3-dark-2: #775e40;\n--palette-3-dark-2-darker: #6b553a;\n--palette-3-dark-2-r: 119;\n--palette-3-dark-2-g: 94;\n--palette-3-dark-2-b: 64;\n--palette-3-dark-2-contrast: white;\n--palette-3-dark-2-contrast-darker: white;\n--palette-3-dark-2-text-color: var(--body-alt-color);\n--palette-3-dark-1: #bb7e33;\n--palette-3-dark-1-darker: #a8712e;\n--palette-3-dark-1-r: 187;\n--palette-3-dark-1-g: 126;\n--palette-3-dark-1-b: 51;\n--palette-3-dark-1-contrast: white;\n--palette-3-dark-1-contrast-darker: white;\n--palette-3-dark-1-text-color: var(--body-alt-color);\n--palette-3: #ff8e02;\n--palette-3-darker: #e78000;\n--palette-3-r: 255;\n--palette-3-g: 142;\n--palette-3-b: 2;\n--palette-3-contrast: white;\n--palette-3-contrast-darker: white;\n--palette-3-text-color: var(--body-alt-color);\n--palette-3-light-1: #ffb04e;\n--palette-3-light-1-darker: #ffa12d;\n--palette-3-light-1-r: 255;\n--palette-3-light-1-g: 176;\n--palette-3-light-1-b: 78;\n--palette-3-light-1-contrast: black;\n--palette-3-light-1-contrast-darker: white;\n--palette-3-light-1-text-color: var(--body-color);\n--palette-3-light-2: #ffd29a;\n--palette-3-light-2-darker: #ffc071;\n--palette-3-light-2-r: 255;\n--palette-3-light-2-g: 210;\n--palette-3-light-2-b: 154;\n--palette-3-light-2-contrast: black;\n--palette-3-light-2-contrast-darker: black;\n--palette-3-light-2-text-color: var(--body-color);\n--palette-3-light-3: #fff4e6;\n--palette-3-light-3-darker: #ffdfb5;\n--palette-3-light-3-r: 255;\n--palette-3-light-3-g: 244;\n--palette-3-light-3-b: 230;\n--palette-3-light-3-contrast: black;\n--palette-3-light-3-contrast-darker: black;\n--palette-3-light-3-text-color: var(--body-color);\n--palette-4-base: #eb5234;\n--palette-4-base-darker: #e83c1a;\n--palette-4-base-r: 235;\n--palette-4-base-g: 82;\n--palette-4-base-b: 52;\n--palette-4-base-contrast: white;\n--palette-4-base-contrast-darker: white;\n--palette-4-base-text-color: var(--body-alt-color);\n--palette-4-dark-3: #332a29;\n--palette-4-dark-3-darker: #2e2625;\n--palette-4-dark-3-r: 51;\n--palette-4-dark-3-g: 42;\n--palette-4-dark-3-b: 41;\n--palette-4-dark-3-contrast: white;\n--palette-4-dark-3-contrast-darker: white;\n--palette-4-dark-3-text-color: var(--body-alt-color);\n--palette-4-dark-2: #704b44;\n--palette-4-dark-2-darker: #65443d;\n--palette-4-dark-2-r: 112;\n--palette-4-dark-2-g: 75;\n--palette-4-dark-2-b: 68;\n--palette-4-dark-2-contrast: white;\n--palette-4-dark-2-contrast-darker: white;\n--palette-4-dark-2-text-color: var(--body-alt-color);\n--palette-4-dark-1: #ae5948;\n--palette-4-dark-1-darker: #9d5041;\n--palette-4-dark-1-r: 174;\n--palette-4-dark-1-g: 89;\n--palette-4-dark-1-b: 72;\n--palette-4-dark-1-contrast: white;\n--palette-4-dark-1-contrast-darker: white;\n--palette-4-dark-1-text-color: var(--body-alt-color);\n--palette-4: #eb5234;\n--palette-4-darker: #e83c1a;\n--palette-4-r: 235;\n--palette-4-g: 82;\n--palette-4-b: 52;\n--palette-4-contrast: white;\n--palette-4-contrast-darker: white;\n--palette-4-text-color: var(--body-alt-color);\n--palette-4-light-1: #f1836e;\n--palette-4-light-1-darker: #ee684e;\n--palette-4-light-1-r: 241;\n--palette-4-light-1-g: 131;\n--palette-4-light-1-b: 110;\n--palette-4-light-1-contrast: white;\n--palette-4-light-1-contrast-darker: white;\n--palette-4-light-1-text-color: var(--body-alt-color);\n--palette-4-light-2: #f7b7aa;\n--palette-4-light-2-darker: #f39784;\n--palette-4-light-2-r: 247;\n--palette-4-light-2-g: 183;\n--palette-4-light-2-b: 170;\n--palette-4-light-2-contrast: black;\n--palette-4-light-2-contrast-darker: white;\n--palette-4-light-2-text-color: var(--body-color);\n--palette-4-light-3: #fdede9;\n--palette-4-light-3-darker: #f9c9bc;\n--palette-4-light-3-r: 253;\n--palette-4-light-3-g: 237;\n--palette-4-light-3-b: 233;\n--palette-4-light-3-contrast: black;\n--palette-4-light-3-contrast-darker: black;\n--palette-4-light-3-text-color: var(--body-color);\n--palette-5-base: #b9c1cc;\n--palette-5-base-darker: #a2adbc;\n--palette-5-base-r: 185;\n--palette-5-base-g: 193;\n--palette-5-base-b: 204;\n--palette-5-base-contrast: black;\n--palette-5-base-contrast-darker: white;\n--palette-5-base-text-color: var(--body-color);\n--palette-5-dark-3: #292d33;\n--palette-5-dark-3-darker: #25292e;\n--palette-5-dark-3-r: 41;\n--palette-5-dark-3-g: 45;\n--palette-5-dark-3-b: 51;\n--palette-5-dark-3-contrast: white;\n--palette-5-dark-3-contrast-darker: white;\n--palette-5-dark-3-text-color: var(--body-alt-color);\n--palette-5-dark-2: #555c66;\n--palette-5-dark-2-darker: #4d535c;\n--palette-5-dark-2-r: 85;\n--palette-5-dark-2-g: 92;\n--palette-5-dark-2-b: 102;\n--palette-5-dark-2-contrast: white;\n--palette-5-dark-2-contrast-darker: white;\n--palette-5-dark-2-text-color: var(--body-alt-color);\n--palette-5-dark-1: #858e99;\n--palette-5-dark-1-darker: #75808c;\n--palette-5-dark-1-r: 133;\n--palette-5-dark-1-g: 142;\n--palette-5-dark-1-b: 153;\n--palette-5-dark-1-contrast: white;\n--palette-5-dark-1-contrast-darker: white;\n--palette-5-dark-1-text-color: var(--body-alt-color);\n--palette-5: #b9c1cc;\n--palette-5-darker: #a2adbc;\n--palette-5-r: 185;\n--palette-5-g: 193;\n--palette-5-b: 204;\n--palette-5-contrast: black;\n--palette-5-contrast-darker: white;\n--palette-5-text-color: var(--body-color);\n--palette-5-light-1: #ccd3db;\n--palette-5-light-1-darker: #b3bec9;\n--palette-5-light-1-r: 204;\n--palette-5-light-1-g: 211;\n--palette-5-light-1-b: 219;\n--palette-5-light-1-contrast: black;\n--palette-5-light-1-contrast-darker: black;\n--palette-5-light-1-text-color: var(--body-color);\n--palette-5-light-2: #e0e5eb;\n--palette-5-light-2-darker: #c4ced9;\n--palette-5-light-2-r: 224;\n--palette-5-light-2-g: 229;\n--palette-5-light-2-b: 235;\n--palette-5-light-2-contrast: black;\n--palette-5-light-2-contrast-darker: black;\n--palette-5-light-2-text-color: var(--body-color);\n--palette-5-light-3: #f5f7fa;\n--palette-5-light-3-darker: #d4dde9;\n--palette-5-light-3-r: 245;\n--palette-5-light-3-g: 247;\n--palette-5-light-3-b: 250;\n--palette-5-light-3-contrast: black;\n--palette-5-light-3-contrast-darker: black;\n--palette-5-light-3-text-color: var(--body-color);\n--grey-40: #999999;\n--grey-40-darker: #8a8a8a;\n--grey-40-r: 153;\n--grey-40-g: 153;\n--grey-40-b: 153;\n--grey-40-contrast: white;\n--grey-40-contrast-darker: white;\n--grey-40-text-color: var(--body-alt-color);\n--grey-30: #b3b3b3;\n--grey-30-darker: #a1a1a1;\n--grey-30-r: 179;\n--grey-30-g: 179;\n--grey-30-b: 179;\n--grey-30-contrast: white;\n--grey-30-contrast-darker: white;\n--grey-30-text-color: var(--body-alt-color);\n--grey-25: #c0c0c0;\n--grey-25-darker: #adadad;\n--grey-25-r: 192;\n--grey-25-g: 192;\n--grey-25-b: 192;\n--grey-25-contrast: black;\n--grey-25-contrast-darker: white;\n--grey-25-text-color: var(--body-color);\n--white: #ffffff;\n--white-darker: #e6e6e6;\n--white-r: 255;\n--white-g: 255;\n--white-b: 255;\n--white-contrast: black;\n--white-contrast-darker: black;\n--white-text-color: var(--body-color);\n--grey-15: #d9d9d9;\n--grey-15-darker: #c3c3c3;\n--grey-15-r: 217;\n--grey-15-g: 217;\n--grey-15-b: 217;\n--grey-15-contrast: black;\n--grey-15-contrast-darker: black;\n--grey-15-text-color: var(--body-color);\n--grey-10: #e5e5e5;\n--grey-10-darker: #cecece;\n--grey-10-r: 229;\n--grey-10-g: 229;\n--grey-10-b: 229;\n--grey-10-contrast: black;\n--grey-10-contrast-darker: black;\n--grey-10-text-color: var(--body-color);\n--grey-5: #f2f2f2;\n--grey-5-darker: #dadada;\n--grey-5-r: 242;\n--grey-5-g: 242;\n--grey-5-b: 242;\n--grey-5-contrast: black;\n--grey-5-contrast-darker: black;\n--grey-5-text-color: var(--body-color);\n--grey-90: #1a1a1a;\n--grey-90-darker: #171717;\n--grey-90-r: 26;\n--grey-90-g: 26;\n--grey-90-b: 26;\n--grey-90-contrast: white;\n--grey-90-contrast-darker: white;\n--grey-90-text-color: var(--body-alt-color);\n--grey-80: #333333;\n--grey-80-darker: #2e2e2e;\n--grey-80-r: 51;\n--grey-80-g: 51;\n--grey-80-b: 51;\n--grey-80-contrast: white;\n--grey-80-contrast-darker: white;\n--grey-80-text-color: var(--body-alt-color);\n--grey-75: #404040;\n--grey-75-darker: #3a3a3a;\n--grey-75-r: 64;\n--grey-75-g: 64;\n--grey-75-b: 64;\n--grey-75-contrast: white;\n--grey-75-contrast-darker: white;\n--grey-75-text-color: var(--body-alt-color);\n--black: #000000;\n--black-darker: #000000;\n--black-r: 0;\n--black-g: 0;\n--black-b: 0;\n--black-contrast: white;\n--black-contrast-darker: white;\n--black-text-color: var(--body-alt-color);\n--grey-70: #4d4d4d;\n--grey-70-darker: #454545;\n--grey-70-r: 77;\n--grey-70-g: 77;\n--grey-70-b: 77;\n--grey-70-contrast: white;\n--grey-70-contrast-darker: white;\n--grey-70-text-color: var(--body-alt-color);\n--grey-60: #666666;\n--grey-60-darker: #5c5c5c;\n--grey-60-r: 102;\n--grey-60-g: 102;\n--grey-60-b: 102;\n--grey-60-contrast: white;\n--grey-60-contrast-darker: white;\n--grey-60-text-color: var(--body-alt-color);\n--grey-50: #808080;\n--grey-50-darker: #737373;\n--grey-50-r: 128;\n--grey-50-g: 128;\n--grey-50-b: 128;\n--grey-50-contrast: white;\n--grey-50-contrast-darker: white;\n--grey-50-text-color: var(--body-alt-color);\n--grey-dark-3: #212121;\n--grey-dark-3-darker: #1e1e1e;\n--grey-dark-3-r: 33;\n--grey-dark-3-g: 33;\n--grey-dark-3-b: 33;\n--grey-dark-3-contrast: white;\n--grey-dark-3-contrast-darker: white;\n--grey-dark-3-text-color: var(--body-alt-color);\n--grey-dark-2: #333333;\n--grey-dark-2-darker: #2e2e2e;\n--grey-dark-2-r: 51;\n--grey-dark-2-g: 51;\n--grey-dark-2-b: 51;\n--grey-dark-2-contrast: white;\n--grey-dark-2-contrast-darker: white;\n--grey-dark-2-text-color: var(--body-alt-color);\n--grey-dark-1: #454545;\n--grey-dark-1-darker: #3e3e3e;\n--grey-dark-1-r: 69;\n--grey-dark-1-g: 69;\n--grey-dark-1-b: 69;\n--grey-dark-1-contrast: white;\n--grey-dark-1-contrast-darker: white;\n--grey-dark-1-text-color: var(--body-alt-color);\n--grey: #b3b3b3;\n--grey-darker: #a1a1a1;\n--grey-r: 179;\n--grey-g: 179;\n--grey-b: 179;\n--grey-contrast: white;\n--grey-contrast-darker: white;\n--grey-text-color: var(--body-alt-color);\n--grey-light-1: #d9d9d9;\n--grey-light-1-darker: #c3c3c3;\n--grey-light-1-r: 217;\n--grey-light-1-g: 217;\n--grey-light-1-b: 217;\n--grey-light-1-contrast: black;\n--grey-light-1-contrast-darker: black;\n--grey-light-1-text-color: var(--body-color);\n--grey-light-2: #eeeeee;\n--grey-light-2-darker: #d6d6d6;\n--grey-light-2-r: 238;\n--grey-light-2-g: 238;\n--grey-light-2-b: 238;\n--grey-light-2-contrast: black;\n--grey-light-2-contrast-darker: black;\n--grey-light-2-text-color: var(--body-color);\n--grey-light-3: #f6f6f6;\n--grey-light-3-darker: #dddddd;\n--grey-light-3-r: 246;\n--grey-light-3-g: 246;\n--grey-light-3-b: 246;\n--grey-light-3-contrast: black;\n--grey-light-3-contrast-darker: black;\n--grey-light-3-text-color: var(--body-color);\n--color-1-base: #28cad9;\n--color-1-base-darker: #23b7c5;\n--color-1-base-r: 40;\n--color-1-base-g: 202;\n--color-1-base-b: 217;\n--color-1-base-contrast: white;\n--color-1-base-contrast-darker: white;\n--color-1-base-text-color: var(--body-alt-color);\n--color-1-dark-3: #293233;\n--color-1-dark-3-darker: #252d2e;\n--color-1-dark-3-r: 41;\n--color-1-dark-3-g: 50;\n--color-1-dark-3-b: 51;\n--color-1-dark-3-contrast: white;\n--color-1-dark-3-contrast-darker: white;\n--color-1-dark-3-text-color: var(--body-alt-color);\n--color-1-dark-2: #3f676a;\n--color-1-dark-2-darker: #395d5f;\n--color-1-dark-2-r: 63;\n--color-1-dark-2-g: 103;\n--color-1-dark-2-b: 106;\n--color-1-dark-2-contrast: white;\n--color-1-dark-2-contrast-darker: white;\n--color-1-dark-2-text-color: var(--body-alt-color);\n--color-1-dark-1: #3f99a2;\n--color-1-dark-1-darker: #398a92;\n--color-1-dark-1-r: 63;\n--color-1-dark-1-g: 153;\n--color-1-dark-1-b: 162;\n--color-1-dark-1-contrast: white;\n--color-1-dark-1-contrast-darker: white;\n--color-1-dark-1-text-color: var(--body-alt-color);\n--color-1: #28cad9;\n--color-1-darker: #23b7c5;\n--color-1-r: 40;\n--color-1-g: 202;\n--color-1-b: 217;\n--color-1-contrast: white;\n--color-1-contrast-darker: white;\n--color-1-text-color: var(--body-alt-color);\n--color-1-light-1: #62d9e4;\n--color-1-light-1-darker: #46d2df;\n--color-1-light-1-r: 98;\n--color-1-light-1-g: 217;\n--color-1-light-1-b: 228;\n--color-1-light-1-contrast: black;\n--color-1-light-1-contrast-darker: black;\n--color-1-light-1-text-color: var(--body-color);\n--color-1-light-2: #a2e9f0;\n--color-1-light-2-darker: #7fe1ea;\n--color-1-light-2-r: 162;\n--color-1-light-2-g: 233;\n--color-1-light-2-b: 240;\n--color-1-light-2-contrast: black;\n--color-1-light-2-contrast-darker: black;\n--color-1-light-2-text-color: var(--body-color);\n--color-1-light-3: #e7f9fb;\n--color-1-light-3-darker: #beeff4;\n--color-1-light-3-r: 231;\n--color-1-light-3-g: 249;\n--color-1-light-3-b: 251;\n--color-1-light-3-contrast: black;\n--color-1-light-3-contrast-darker: black;\n--color-1-light-3-text-color: var(--body-color);\n--color-2-base: #f0005f;\n--color-2-base-darker: #d80055;\n--color-2-base-r: 240;\n--color-2-base-g: 0;\n--color-2-base-b: 95;\n--color-2-base-contrast: white;\n--color-2-base-contrast-darker: white;\n--color-2-base-text-color: var(--body-alt-color);\n--color-2-dark-3: #33292d;\n--color-2-dark-3-darker: #2e2529;\n--color-2-dark-3-r: 51;\n--color-2-dark-3-g: 41;\n--color-2-dark-3-b: 45;\n--color-2-dark-3-contrast: white;\n--color-2-dark-3-contrast-darker: white;\n--color-2-dark-3-text-color: var(--body-alt-color);\n--color-2-dark-2: #723d52;\n--color-2-dark-2-darker: #67374a;\n--color-2-dark-2-r: 114;\n--color-2-dark-2-g: 61;\n--color-2-dark-2-b: 82;\n--color-2-dark-2-contrast: white;\n--color-2-dark-2-contrast-darker: white;\n--color-2-dark-2-text-color: var(--body-alt-color);\n--color-2-dark-1: #b12f63;\n--color-2-dark-1-darker: #9f2a59;\n--color-2-dark-1-r: 177;\n--color-2-dark-1-g: 47;\n--color-2-dark-1-b: 99;\n--color-2-dark-1-contrast: white;\n--color-2-dark-1-contrast-darker: white;\n--color-2-dark-1-text-color: var(--body-alt-color);\n--color-2: #f0005f;\n--color-2-darker: #d80055;\n--color-2-r: 240;\n--color-2-g: 0;\n--color-2-b: 95;\n--color-2-contrast: white;\n--color-2-contrast-darker: white;\n--color-2-text-color: var(--body-alt-color);\n--color-2-light-1: #f5498d;\n--color-2-light-1-darker: #f32b7a;\n--color-2-light-1-r: 245;\n--color-2-light-1-g: 73;\n--color-2-light-1-b: 141;\n--color-2-light-1-contrast: white;\n--color-2-light-1-contrast-darker: white;\n--color-2-light-1-text-color: var(--body-alt-color);\n--color-2-light-2: #f995bd;\n--color-2-light-2-darker: #f76fa6;\n--color-2-light-2-r: 249;\n--color-2-light-2-g: 149;\n--color-2-light-2-b: 189;\n--color-2-light-2-contrast: white;\n--color-2-light-2-contrast-darker: white;\n--color-2-light-2-text-color: var(--body-alt-color);\n--color-2-light-3: #fee4ee;\n--color-2-light-3-darker: #fcb6d1;\n--color-2-light-3-r: 254;\n--color-2-light-3-g: 228;\n--color-2-light-3-b: 238;\n--color-2-light-3-contrast: black;\n--color-2-light-3-contrast-darker: black;\n--color-2-light-3-text-color: var(--body-color);\n--color-3-base: #ff8e02;\n--color-3-base-darker: #e78000;\n--color-3-base-r: 255;\n--color-3-base-g: 142;\n--color-3-base-b: 2;\n--color-3-base-contrast: white;\n--color-3-base-contrast-darker: white;\n--color-3-base-text-color: var(--body-alt-color);\n--color-3-dark-3: #332e29;\n--color-3-dark-3-darker: #2e2925;\n--color-3-dark-3-r: 51;\n--color-3-dark-3-g: 46;\n--color-3-dark-3-b: 41;\n--color-3-dark-3-contrast: white;\n--color-3-dark-3-contrast-darker: white;\n--color-3-dark-3-text-color: var(--body-alt-color);\n--color-3-dark-2: #775e40;\n--color-3-dark-2-darker: #6b553a;\n--color-3-dark-2-r: 119;\n--color-3-dark-2-g: 94;\n--color-3-dark-2-b: 64;\n--color-3-dark-2-contrast: white;\n--color-3-dark-2-contrast-darker: white;\n--color-3-dark-2-text-color: var(--body-alt-color);\n--color-3-dark-1: #bb7e33;\n--color-3-dark-1-darker: #a8712e;\n--color-3-dark-1-r: 187;\n--color-3-dark-1-g: 126;\n--color-3-dark-1-b: 51;\n--color-3-dark-1-contrast: white;\n--color-3-dark-1-contrast-darker: white;\n--color-3-dark-1-text-color: var(--body-alt-color);\n--color-3: #ff8e02;\n--color-3-darker: #e78000;\n--color-3-r: 255;\n--color-3-g: 142;\n--color-3-b: 2;\n--color-3-contrast: white;\n--color-3-contrast-darker: white;\n--color-3-text-color: var(--body-alt-color);\n--color-3-light-1: #ffb04e;\n--color-3-light-1-darker: #ffa12d;\n--color-3-light-1-r: 255;\n--color-3-light-1-g: 176;\n--color-3-light-1-b: 78;\n--color-3-light-1-contrast: black;\n--color-3-light-1-contrast-darker: white;\n--color-3-light-1-text-color: var(--body-color);\n--color-3-light-2: #ffd29a;\n--color-3-light-2-darker: #ffc071;\n--color-3-light-2-r: 255;\n--color-3-light-2-g: 210;\n--color-3-light-2-b: 154;\n--color-3-light-2-contrast: black;\n--color-3-light-2-contrast-darker: black;\n--color-3-light-2-text-color: var(--body-color);\n--color-3-light-3: #fff4e6;\n--color-3-light-3-darker: #ffdfb5;\n--color-3-light-3-r: 255;\n--color-3-light-3-g: 244;\n--color-3-light-3-b: 230;\n--color-3-light-3-contrast: black;\n--color-3-light-3-contrast-darker: black;\n--color-3-light-3-text-color: var(--body-color);\n--color-4-base: #eb5234;\n--color-4-base-darker: #e83c1a;\n--color-4-base-r: 235;\n--color-4-base-g: 82;\n--color-4-base-b: 52;\n--color-4-base-contrast: white;\n--color-4-base-contrast-darker: white;\n--color-4-base-text-color: var(--body-alt-color);\n--color-4-dark-3: #332a29;\n--color-4-dark-3-darker: #2e2625;\n--color-4-dark-3-r: 51;\n--color-4-dark-3-g: 42;\n--color-4-dark-3-b: 41;\n--color-4-dark-3-contrast: white;\n--color-4-dark-3-contrast-darker: white;\n--color-4-dark-3-text-color: var(--body-alt-color);\n--color-4-dark-2: #704b44;\n--color-4-dark-2-darker: #65443d;\n--color-4-dark-2-r: 112;\n--color-4-dark-2-g: 75;\n--color-4-dark-2-b: 68;\n--color-4-dark-2-contrast: white;\n--color-4-dark-2-contrast-darker: white;\n--color-4-dark-2-text-color: var(--body-alt-color);\n--color-4-dark-1: #ae5948;\n--color-4-dark-1-darker: #9d5041;\n--color-4-dark-1-r: 174;\n--color-4-dark-1-g: 89;\n--color-4-dark-1-b: 72;\n--color-4-dark-1-contrast: white;\n--color-4-dark-1-contrast-darker: white;\n--color-4-dark-1-text-color: var(--body-alt-color);\n--color-4: #eb5234;\n--color-4-darker: #e83c1a;\n--color-4-r: 235;\n--color-4-g: 82;\n--color-4-b: 52;\n--color-4-contrast: white;\n--color-4-contrast-darker: white;\n--color-4-text-color: var(--body-alt-color);\n--color-4-light-1: #f1836e;\n--color-4-light-1-darker: #ee684e;\n--color-4-light-1-r: 241;\n--color-4-light-1-g: 131;\n--color-4-light-1-b: 110;\n--color-4-light-1-contrast: white;\n--color-4-light-1-contrast-darker: white;\n--color-4-light-1-text-color: var(--body-alt-color);\n--color-4-light-2: #f7b7aa;\n--color-4-light-2-darker: #f39784;\n--color-4-light-2-r: 247;\n--color-4-light-2-g: 183;\n--color-4-light-2-b: 170;\n--color-4-light-2-contrast: black;\n--color-4-light-2-contrast-darker: white;\n--color-4-light-2-text-color: var(--body-color);\n--color-4-light-3: #fdede9;\n--color-4-light-3-darker: #f9c9bc;\n--color-4-light-3-r: 253;\n--color-4-light-3-g: 237;\n--color-4-light-3-b: 233;\n--color-4-light-3-contrast: black;\n--color-4-light-3-contrast-darker: black;\n--color-4-light-3-text-color: var(--body-color);\n--color-5-base: #b9c1cc;\n--color-5-base-darker: #a2adbc;\n--color-5-base-r: 185;\n--color-5-base-g: 193;\n--color-5-base-b: 204;\n--color-5-base-contrast: black;\n--color-5-base-contrast-darker: white;\n--color-5-base-text-color: var(--body-color);\n--color-5-dark-3: #292d33;\n--color-5-dark-3-darker: #25292e;\n--color-5-dark-3-r: 41;\n--color-5-dark-3-g: 45;\n--color-5-dark-3-b: 51;\n--color-5-dark-3-contrast: white;\n--color-5-dark-3-contrast-darker: white;\n--color-5-dark-3-text-color: var(--body-alt-color);\n--color-5-dark-2: #555c66;\n--color-5-dark-2-darker: #4d535c;\n--color-5-dark-2-r: 85;\n--color-5-dark-2-g: 92;\n--color-5-dark-2-b: 102;\n--color-5-dark-2-contrast: white;\n--color-5-dark-2-contrast-darker: white;\n--color-5-dark-2-text-color: var(--body-alt-color);\n--color-5-dark-1: #858e99;\n--color-5-dark-1-darker: #75808c;\n--color-5-dark-1-r: 133;\n--color-5-dark-1-g: 142;\n--color-5-dark-1-b: 153;\n--color-5-dark-1-contrast: white;\n--color-5-dark-1-contrast-darker: white;\n--color-5-dark-1-text-color: var(--body-alt-color);\n--color-5: #b9c1cc;\n--color-5-darker: #a2adbc;\n--color-5-r: 185;\n--color-5-g: 193;\n--color-5-b: 204;\n--color-5-contrast: black;\n--color-5-contrast-darker: white;\n--color-5-text-color: var(--body-color);\n--color-5-light-1: #ccd3db;\n--color-5-light-1-darker: #b3bec9;\n--color-5-light-1-r: 204;\n--color-5-light-1-g: 211;\n--color-5-light-1-b: 219;\n--color-5-light-1-contrast: black;\n--color-5-light-1-contrast-darker: black;\n--color-5-light-1-text-color: var(--body-color);\n--color-5-light-2: #e0e5eb;\n--color-5-light-2-darker: #c4ced9;\n--color-5-light-2-r: 224;\n--color-5-light-2-g: 229;\n--color-5-light-2-b: 235;\n--color-5-light-2-contrast: black;\n--color-5-light-2-contrast-darker: black;\n--color-5-light-2-text-color: var(--body-color);\n--color-5-light-3: #f5f7fa;\n--color-5-light-3-darker: #d4dde9;\n--color-5-light-3-r: 245;\n--color-5-light-3-g: 247;\n--color-5-light-3-b: 250;\n--color-5-light-3-contrast: black;\n--color-5-light-3-contrast-darker: black;\n--color-5-light-3-text-color: var(--body-color);\n--white-contrast: var(--body-color);\n--shading-contrast: var(--body-alt-color);\n--bg-contrast: var(--body-color);\n}.u-custom-color-1,\n        .u-body.u-custom-color-1,\n        .u-container-style.u-custom-color-1:before,\n        .u-table-alt-custom-color-1 tr:nth-child(even)\n        {\n            color: var(--custom-color-1-text-color);\n            background-color: var(--custom-color-1);\n        }\n\n        .u-button-style.u-custom-color-1,\n        .u-button-style.u-custom-color-1[class*=\"u-border-\"]\n        {\n            color: var(--custom-color-1-text-color) !important;\n            background-color: var(--custom-color-1) !important;\n        }\n\n        .u-button-style.u-custom-color-1:hover,\n        .u-button-style.u-custom-color-1[class*=\"u-border-\"]:hover,\n        .u-button-style.u-custom-color-1:focus,\n        .u-button-style.u-custom-color-1[class*=\"u-border-\"]:focus,\n        .u-button-style.u-button-style.u-custom-color-1:active,\n        .u-button-style.u-button-style.u-custom-color-1[class*=\"u-border-\"]:active,\n        .u-button-style.u-button-style.u-custom-color-1.active,\n        .u-button-style.u-button-style.u-custom-color-1[class*=\"u-border-\"].active,\n        li.active > .u-button-style.u-button-style.u-custom-color-1,\n        li.active > .u-button-style.u-button-style.u-custom-color-1[class*=\"u-border-\"]\n        {\n            color: var(--custom-color-1-text-color) !important;\n            background-color: var(--custom-color-1-darker) !important;\n        }\n\n        .u-hover-custom-color-1:hover,\n        .u-hover-custom-color-1[class*=\"u-border-\"]:hover,\n        .u-hover-custom-color-1:focus,\n        .u-hover-custom-color-1[class*=\"u-border-\"]:focus,\n        .u-active-custom-color-1.u-active.u-active,\n        .u-active-custom-color-1[class*=\"u-border-\"].u-active.u-active,\n        a.u-button-style.u-hover-custom-color-1:hover,\n        a.u-button-style.u-hover-custom-color-1[class*=\"u-border-\"]:hover,\n        a.u-button-style.u-hover-custom-color-1:focus,\n        a.u-button-style.u-hover-custom-color-1[class*=\"u-border-\"]:focus,\n        a.u-button-style.u-button-style.u-active-custom-color-1:active,\n        a.u-button-style.u-button-style.u-active-custom-color-1[class*=\"u-border-\"]:active,\n        a.u-button-style.u-button-style.u-active-custom-color-1.active,\n        a.u-button-style.u-button-style.u-active-custom-color-1[class*=\"u-border-\"].active,\n        li.active > a.u-button-style.u-button-style.u-active-custom-color-1,\n        li.active > a.u-button-style.u-button-style.u-active-custom-color-1[class*=\"u-border-\"]\n        {\n            color: var(--custom-color-1-text-color) !important;\n            background-color: var(--custom-color-1) !important;\n        }\n\n        a.u-link.u-hover-custom-color-1:hover {\n            color: var(--custom-color-1) !important;\n        }\n\n        \n\n        \n        .u-border-custom-color-1,\n        .u-separator-custom-color-1:after\n        {\n            border-color: var(--custom-color-1);\n            stroke: var(--custom-color-1);\n        }\n\n        .u-button-style.u-border-custom-color-1\n        {\n            border-color: var(--custom-color-1) !important;\n            color: var(--custom-color-1) !important;\n            background-color: transparent !important;\n        }\n\n        .u-button-style.u-border-custom-color-1:hover,\n        .u-button-style.u-border-custom-color-1:focus\n        {\n            border-color: var(--custom-color-1-darker) !important;\n            color: var(--custom-color-1-darker) !important;\n            background-color: transparent !important;\n        }\n\n        .u-border-hover-custom-color-1:hover,\n        .u-border-hover-custom-color-1:focus,\n        .u-border-active-custom-color-1.u-active.u-active,\n        a.u-button-style.u-border-hover-custom-color-1:hover,\n        a.u-button-style.u-border-hover-custom-color-1:focus,\n        a.u-button-style.u-button-style.u-border-active-custom-color-1:active,\n        a.u-button-style.u-button-style.u-border-active-custom-color-1.active,\n        li.active > a.u-button-style.u-button-style.u-border-active-custom-color-1\n        {\n            color: var(--custom-color-1) !important;\n            border-color: var(--custom-color-1) !important;\n        }\n\n        .u-link.u-border-custom-color-1[class*=\"u-border-\"]\n        {\n            border-color: var(--custom-color-1) !important;\n        }\n\n        .u-link.u-border-custom-color-1[class*=\"u-border-\"]:hover\n        {\n            border-color: var(--custom-color-1-darker) !important;\n        }\n        \n\n        \n        .u-text-custom-color-1,\n        a.u-button-style.u-text-custom-color-1,\n        a.u-button-style.u-text-custom-color-1[class*=\"u-border-\"]\n        {\n            color: var(--custom-color-1) !important;\n        }\n\n        a.u-button-style.u-text-custom-color-1:hover,\n        a.u-button-style.u-text-custom-color-1[class*=\"u-border-\"]:hover,\n        a.u-button-style.u-text-custom-color-1:focus,\n        a.u-button-style.u-text-custom-color-1[class*=\"u-border-\"]:focus,\n        a.u-button-style.u-button-style.u-text-custom-color-1:active,\n        a.u-button-style.u-button-style.u-text-custom-color-1[class*=\"u-border-\"]:active,\n        a.u-button-style.u-button-style.u-text-custom-color-1.active,\n        a.u-button-style.u-button-style.u-text-custom-color-1[class*=\"u-border-\"].active\n        {\n            color: var(--custom-color-1-darker) !important;\n        }\n\n        a.u-button-style.u-button-style.u-text-hover-custom-color-1:hover,\n        a.u-button-style.u-button-style.u-text-hover-custom-color-1[class*=\"u-border-\"]:hover,\n        a.u-button-style.u-button-style.u-text-hover-custom-color-1:focus,\n        a.u-button-style.u-button-style.u-text-hover-custom-color-1[class*=\"u-border-\"]:focus,\n        a.u-button-style.u-button-style.u-button-style.u-text-active-custom-color-1:active,\n        a.u-button-style.u-button-style.u-button-style.u-text-active-custom-color-1[class*=\"u-border-\"]:active,\n        a.u-button-style.u-button-style.u-button-style.u-text-active-custom-color-1.active,\n        a.u-button-style.u-button-style.u-button-style.u-text-active-custom-color-1[class*=\"u-border-\"].active,\n        :not(.level-2) > .u-nav > .u-nav-item > a.u-nav-link.u-text-hover-custom-color-1:hover,\n        :not(.level-2) > .u-nav > .u-nav-item > a.u-nav-link.u-nav-link.u-text-active-custom-color-1.active,\n        .u-popupmenu-items.u-text-hover-custom-color-1 .u-nav-link:hover,\n        .u-popupmenu-items.u-popupmenu-items.u-text-active-custom-color-1 .u-nav-link.active\n        {\n            color: var(--custom-color-1) !important;\n        }\n\n        .u-text-custom-color-1 svg,\n        .u-text-hover-custom-color-1:hover svg,\n        .u-text-hover-custom-color-1:focus svg\n        {\n            fill: var(--custom-color-1);\n        }\n\n        .u-link.u-text-custom-color-1:hover\n        {\n            color: var(--custom-color-1-darker) !important;\n        }\n\n        a.u-link.u-text-hover-custom-color-1:hover\n        {\n            color: var(--custom-color-1) !important;\n        }</style><style id=\"typography\" typography=\"Normal\">\n        .u-body\n        {\n        --title-font-weight: 400;\n        --title-font-size: 4.5rem;\n        --title-line-height: 1.1;\n        --title-margin-top: 20px;\n        --title-margin-bottom: 20px;\n        --subtitle-font-weight: 400;\n        --subtitle-font-size: 2.25rem;\n        --subtitle-line-height: 1.1;\n        --subtitle-margin-top: 20px;\n        --subtitle-margin-bottom: 20px;\n        --h1-font-weight: 400;\n        --h1-font-size: 3rem;\n        --h1-line-height: 1.1;\n        --h1-margin-top: 20px;\n        --h1-margin-bottom: 20px;\n        --h2-font-weight: 400;\n        --h2-font-size: 2.25rem;\n        --h2-line-height: 1.1;\n        --h2-margin-top: 20px;\n        --h2-margin-bottom: 20px;\n        --h3-font-weight: 400;\n        --h3-font-size: 1.875rem;\n        --h3-line-height: 1.2;\n        --h3-margin-top: 20px;\n        --h3-margin-bottom: 20px;\n        --h4-font-weight: 400;\n        --h4-font-size: 1.5rem;\n        --h4-line-height: 1.2;\n        --h4-margin-top: 20px;\n        --h4-margin-bottom: 20px;\n        --h5-font-weight: 400;\n        --h5-font-size: 1.25rem;\n        --h5-line-height: 1.2;\n        --h5-margin-top: 20px;\n        --h5-margin-bottom: 20px;\n        --h6-font-weight: 400;\n        --h6-font-size: 1.125rem;\n        --h6-line-height: 1.2;\n        --h6-margin-top: 20px;\n        --h6-margin-bottom: 20px;\n        --largeText-font-size: 1.25rem;\n        --largeText-margin-top: 20px;\n        --largeText-margin-bottom: 20px;\n        --smallText-font-size: 0.875rem;\n        --smallText-margin-top: 20px;\n        --smallText-margin-bottom: 20px;\n        --text-margin-top: 20px;\n        --text-margin-bottom: 20px;\n        --hyperlink-color: var(--palette-1-base);\n        --hyperlink-alt-text-color: var(--palette-1-light-2);\n        --hyperlink-hover-color: var(--palette-1-base-darker);\n        --hyperlink-hover-alt-text-color: var(--grey-30-darker);\n        --button-margin-top: 20px;\n        --button-margin-bottom: 20px;\n        --button-background-color: var(--palette-1-base);\n        --button-color: var(--white);\n        --button-alt-background-color: var(--palette-1-light-2);\n        --button-alt-color: var(--black);\n        --button-hover-background-color: var(--palette-1-base-darker);\n        --button-hover-color: var(--white-darker);\n        --button-hover-alt-background-color: var(--palette-1-light-2-darker);\n        --button-hover-alt-color: var(--white);\n        --button-hover-background-color: var(--palette-1-base-darker);\n        --button-hover-color: var(--white-darker);\n        --button-hover-alt-background-color: var(--palette-1-light-2-darker);\n        --button-hover-alt-color: var(--white);\n        --button-active-background-color: var(--palette-1-base-darker);\n        --button-active-color: var(--white-darker);\n        --button-active-alt-background-color: var(--palette-1-light-2-darker);\n        --button-active-alt-color: var(--white);\n        --blockquote-font-style: italic;\n        --blockquote-padding-left: 20px;\n        --blockquote-border-width: 4px;\n        --blockquote-border-color: var(--palette-1-base);\n        --blockquote-margin-top: 20px;\n        --blockquote-margin-bottom: 20px;\n        --metadata-margin-top: 20px;\n        --metadata-margin-bottom: 20px;\n        --list-margin-top: 20px;\n        --list-margin-bottom: 20px;\n        --orderedlist-margin-top: 20px;\n        --orderedlist-margin-bottom: 20px;\n        --postContent-margin-top: 20px;\n        --postContent-margin-bottom: 20px;\n        --title-font-size-sm: 3.75rem;\n        --title-font-size-xs: 3rem;\n        --subtitle-font-size-xs: 1.5rem;\n        --h1-font-size-xs: 2.25rem;\n        --h2-font-size-xs: 1.5rem;\n        --h3-font-size-xs: 1.5rem;\n        }\n\n        /** common-rules **/\n        h1.u-title\n        {\n        font-weight: var(--title-font-weight);\n        font-size: var(--title-font-size);\n        line-height: var(--title-line-height);\n        margin-top: var(--title-margin-top);\n        margin-bottom: var(--title-margin-bottom);\n        }\n        h2.u-subtitle\n        {\n        font-weight: var(--subtitle-font-weight);\n        font-size: var(--subtitle-font-size);\n        line-height: var(--subtitle-line-height);\n        margin-top: var(--subtitle-margin-top);\n        margin-bottom: var(--subtitle-margin-bottom);\n        }\n        h1:not(.u-title)\n        {\n        font-weight: var(--h1-font-weight);\n        font-size: var(--h1-font-size);\n        line-height: var(--h1-line-height);\n        margin-top: var(--h1-margin-top);\n        margin-bottom: var(--h1-margin-bottom);\n        }\n        h2:not(.u-subtitle)\n        {\n        font-weight: var(--h2-font-weight);\n        font-size: var(--h2-font-size);\n        line-height: var(--h2-line-height);\n        margin-top: var(--h2-margin-top);\n        margin-bottom: var(--h2-margin-bottom);\n        }\n        h3\n        {\n        font-weight: var(--h3-font-weight);\n        font-size: var(--h3-font-size);\n        line-height: var(--h3-line-height);\n        margin-top: var(--h3-margin-top);\n        margin-bottom: var(--h3-margin-bottom);\n        }\n        h4\n        {\n        font-weight: var(--h4-font-weight);\n        font-size: var(--h4-font-size);\n        line-height: var(--h4-line-height);\n        margin-top: var(--h4-margin-top);\n        margin-bottom: var(--h4-margin-bottom);\n        }\n        h5\n        {\n        font-weight: var(--h5-font-weight);\n        font-size: var(--h5-font-size);\n        line-height: var(--h5-line-height);\n        margin-top: var(--h5-margin-top);\n        margin-bottom: var(--h5-margin-bottom);\n        }\n        h6\n        {\n        font-weight: var(--h6-font-weight);\n        font-size: var(--h6-font-size);\n        line-height: var(--h6-line-height);\n        margin-top: var(--h6-margin-top);\n        margin-bottom: var(--h6-margin-bottom);\n        }\n        p.u-large-text\n        {\n        font-size: var(--largeText-font-size);\n        margin-top: var(--largeText-margin-top);\n        margin-bottom: var(--largeText-margin-bottom);\n        }\n        p.u-small-text\n        {\n        font-size: var(--smallText-font-size);\n        margin-top: var(--smallText-margin-top);\n        margin-bottom: var(--smallText-margin-bottom);\n        }\n        p:not(.u-text-variant)\n        {\n        margin-top: var(--text-margin-top);\n        margin-bottom: var(--text-margin-bottom);\n        }\n        .u-btn\n        {\n        margin-top: var(--button-margin-top);\n        margin-bottom: var(--button-margin-bottom);\n        }\n        blockquote\n        {\n        font-style: var(--blockquote-font-style);\n        padding-left: var(--blockquote-padding-left);\n        border-width: var(--blockquote-border-width);\n        margin-top: var(--blockquote-margin-top);\n        margin-bottom: var(--blockquote-margin-bottom);\n        }\n        .u-metadata\n        {\n        margin-top: var(--metadata-margin-top);\n        margin-bottom: var(--metadata-margin-bottom);\n        }\n        ul:not(.u-unstyled)\n        {\n        margin-top: var(--list-margin-top);\n        margin-bottom: var(--list-margin-bottom);\n        }\n        ol\n        {\n        margin-top: var(--orderedlist-margin-top);\n        margin-bottom: var(--orderedlist-margin-bottom);\n        }\n        .u-post-content\n        {\n        margin-top: var(--postContent-margin-top);\n        margin-bottom: var(--postContent-margin-bottom);\n        }\n        /** common-rules **/\n\n        /** publish-rules **/\n        /*begin-media rules*/\n        @media (max-width: 767px) {\n        h1.u-title\n        {\n        font-size: var(--title-font-size-sm);\n        }\n        }\n        @media (max-width: 575px) {\n        h1.u-title\n        {\n        font-size: var(--title-font-size-xs);\n        }\n        }\n        @media (max-width: 575px) {\n        h2.u-subtitle\n        {\n        font-size: var(--subtitle-font-size-xs);\n        }\n        }\n        @media (max-width: 575px) {\n        h1:not(.u-title)\n        {\n        font-size: var(--h1-font-size-xs);\n        }\n        }\n        @media (max-width: 575px) {\n        h2:not(.u-subtitle)\n        {\n        font-size: var(--h2-font-size-xs);\n        }\n        }\n        @media (max-width: 575px) {\n        h3\n        {\n        font-size: var(--h3-font-size-xs);\n        }\n        }\n        /*end-media rules*/\n        /** publish-rules **/\n\n        \n\n        /** cms-rules **/\n        /*begin-responsive rules*/\n        .u-sm h1.u-title\n        {\n        font-size: var(--title-font-size-sm);\n        }\n        .u-xs h1.u-title\n        {\n        font-size: var(--title-font-size-xs);\n        }\n        .u-xs h2.u-subtitle\n        {\n        font-size: var(--subtitle-font-size-xs);\n        }\n        .u-xs h1:not(.u-title)\n        {\n        font-size: var(--h1-font-size-xs);\n        }\n        .u-xs h2:not(.u-subtitle)\n        {\n        font-size: var(--h2-font-size-xs);\n        }\n        .u-xs h3\n        {\n        font-size: var(--h3-font-size-xs);\n        }\n        /*end-responsive rules*/\n        /** cms-rules **/\n\n        /** color-rules **/\n        .u-overlap.u-overlap-transparent:not(.u-overlap-contrast) .u-header :not(.u-nav-item) > a,\n        .u-gradient > .u-container-layout > a,\n        .u-image:not(.u-shading) > .u-container-layout > a,\n        a\n        {\n        color: var(--hyperlink-color);\n        }\n        .u-overlap.u-overlap-transparent:not(.u-overlap-contrast) .u-header :not(.u-nav-item) > a:hover,\n        .u-gradient > .u-container-layout > a:hover,\n        .u-image:not(.u-shading) > .u-container-layout > a:hover,\n        a:hover\n        {\n        color: var(--hyperlink-hover-color);\n        }\n        .u-overlap.u-overlap-transparent:not(.u-overlap-contrast) .u-header :not(.u-nav-item) > .u-btn,\n        .u-gradient > .u-container-layout > .u-btn,\n        .u-image:not(.u-shading) > .u-container-layout > .u-btn,\n        .u-btn\n        {\n        background-color: var(--button-background-color);\n        color: var(--button-color);\n        }\n        .u-overlap.u-overlap-transparent:not(.u-overlap-contrast) .u-header :not(.u-nav-item) > .u-btn:hover,\n        .u-gradient > .u-container-layout > .u-btn:hover,\n        .u-image:not(.u-shading) > .u-container-layout > .u-btn:hover,\n        .u-btn:hover\n        {\n        background-color: var(--button-hover-background-color);\n        color: var(--button-hover-color);\n        }\n        .u-overlap.u-overlap-transparent:not(.u-overlap-contrast) .u-header :not(.u-nav-item) > .u-btn:focus,\n        .u-gradient > .u-container-layout > .u-btn:focus,\n        .u-image:not(.u-shading) > .u-container-layout > .u-btn:focus,\n        .u-btn:focus\n        {\n        background-color: var(--button-hover-background-color);\n        color: var(--button-hover-color);\n        }\n        .u-overlap.u-overlap-transparent:not(.u-overlap-contrast) .u-header :not(.u-nav-item) > .u-btn:active,\n        .u-gradient > .u-container-layout > .u-btn:active,\n        .u-image:not(.u-shading) > .u-container-layout > .u-btn:active,\n        .u-btn:active\n        {\n        background-color: var(--button-active-background-color);\n        color: var(--button-active-color);\n        }\n        .u-overlap.u-overlap-transparent:not(.u-overlap-contrast) .u-header :not(.u-nav-item) > blockquote,\n        .u-gradient > .u-container-layout > blockquote,\n        .u-image:not(.u-shading) > .u-container-layout > blockquote,\n        blockquote\n        {\n        border-color: var(--blockquote-border-color);\n        }\n        /** color-rules **/\n\n        /** alt-color-rules **/\n        .u-custom-color-1 a,.u-body-color a,.u-palette-1-base a,.u-palette-1-dark-3 a,.u-palette-1-dark-2 a,.u-palette-1-dark-1 a,.u-palette-1 a,.u-palette-2-base a,.u-palette-2-dark-3 a,.u-palette-2-dark-2 a,.u-palette-2-dark-1 a,.u-palette-2 a,.u-palette-2-light-1 a,.u-palette-2-light-2 a,.u-palette-3-base a,.u-palette-3-dark-3 a,.u-palette-3-dark-2 a,.u-palette-3-dark-1 a,.u-palette-3 a,.u-palette-4-base a,.u-palette-4-dark-3 a,.u-palette-4-dark-2 a,.u-palette-4-dark-1 a,.u-palette-4 a,.u-palette-4-light-1 a,.u-palette-5-dark-3 a,.u-palette-5-dark-2 a,.u-palette-5-dark-1 a,.u-grey-40 a,.u-grey-30 a,.u-grey-90 a,.u-grey-80 a,.u-grey-75 a,.u-black a,.u-grey-70 a,.u-grey-60 a,.u-grey-50 a,.u-grey-dark-3 a,.u-grey-dark-2 a,.u-grey-dark-1 a,.u-grey a,.u-shading a,.u-overlap-contrast .u-header a:not(.u-nav-link):not(.u-btn)\n        {\n        color: var(--hyperlink-alt-text-color);\n        }\n        .u-custom-color-1 a:hover,.u-body-color a:hover,.u-palette-1-base a:hover,.u-palette-1-dark-3 a:hover,.u-palette-1-dark-2 a:hover,.u-palette-1-dark-1 a:hover,.u-palette-1 a:hover,.u-palette-2-base a:hover,.u-palette-2-dark-3 a:hover,.u-palette-2-dark-2 a:hover,.u-palette-2-dark-1 a:hover,.u-palette-2 a:hover,.u-palette-2-light-1 a:hover,.u-palette-2-light-2 a:hover,.u-palette-3-base a:hover,.u-palette-3-dark-3 a:hover,.u-palette-3-dark-2 a:hover,.u-palette-3-dark-1 a:hover,.u-palette-3 a:hover,.u-palette-4-base a:hover,.u-palette-4-dark-3 a:hover,.u-palette-4-dark-2 a:hover,.u-palette-4-dark-1 a:hover,.u-palette-4 a:hover,.u-palette-4-light-1 a:hover,.u-palette-5-dark-3 a:hover,.u-palette-5-dark-2 a:hover,.u-palette-5-dark-1 a:hover,.u-grey-40 a:hover,.u-grey-30 a:hover,.u-grey-90 a:hover,.u-grey-80 a:hover,.u-grey-75 a:hover,.u-black a:hover,.u-grey-70 a:hover,.u-grey-60 a:hover,.u-grey-50 a:hover,.u-grey-dark-3 a:hover,.u-grey-dark-2 a:hover,.u-grey-dark-1 a:hover,.u-grey a:hover\n        {\n        color: var(--hyperlink-hover-alt-text-color);\n        }\n        .u-custom-color-1 .u-btn,.u-body-color .u-btn,.u-palette-1-base .u-btn,.u-palette-1-dark-3 .u-btn,.u-palette-1-dark-2 .u-btn,.u-palette-1-dark-1 .u-btn,.u-palette-1 .u-btn,.u-palette-2-base .u-btn,.u-palette-2-dark-3 .u-btn,.u-palette-2-dark-2 .u-btn,.u-palette-2-dark-1 .u-btn,.u-palette-2 .u-btn,.u-palette-2-light-1 .u-btn,.u-palette-2-light-2 .u-btn,.u-palette-3-base .u-btn,.u-palette-3-dark-3 .u-btn,.u-palette-3-dark-2 .u-btn,.u-palette-3-dark-1 .u-btn,.u-palette-3 .u-btn,.u-palette-4-base .u-btn,.u-palette-4-dark-3 .u-btn,.u-palette-4-dark-2 .u-btn,.u-palette-4-dark-1 .u-btn,.u-palette-4 .u-btn,.u-palette-4-light-1 .u-btn,.u-palette-5-dark-3 .u-btn,.u-palette-5-dark-2 .u-btn,.u-palette-5-dark-1 .u-btn,.u-grey-40 .u-btn,.u-grey-30 .u-btn,.u-grey-90 .u-btn,.u-grey-80 .u-btn,.u-grey-75 .u-btn,.u-black .u-btn,.u-grey-70 .u-btn,.u-grey-60 .u-btn,.u-grey-50 .u-btn,.u-grey-dark-3 .u-btn,.u-grey-dark-2 .u-btn,.u-grey-dark-1 .u-btn,.u-grey .u-btn,.u-shading .u-btn,.u-overlap-contrast .u-header .u-btn\n        {\n        background-color: var(--button-alt-background-color);\n        color: var(--button-alt-color);\n        }\n        .u-custom-color-1 .u-btn:hover,.u-body-color .u-btn:hover,.u-palette-1-base .u-btn:hover,.u-palette-1-dark-3 .u-btn:hover,.u-palette-1-dark-2 .u-btn:hover,.u-palette-1-dark-1 .u-btn:hover,.u-palette-1 .u-btn:hover,.u-palette-2-base .u-btn:hover,.u-palette-2-dark-3 .u-btn:hover,.u-palette-2-dark-2 .u-btn:hover,.u-palette-2-dark-1 .u-btn:hover,.u-palette-2 .u-btn:hover,.u-palette-2-light-1 .u-btn:hover,.u-palette-2-light-2 .u-btn:hover,.u-palette-3-base .u-btn:hover,.u-palette-3-dark-3 .u-btn:hover,.u-palette-3-dark-2 .u-btn:hover,.u-palette-3-dark-1 .u-btn:hover,.u-palette-3 .u-btn:hover,.u-palette-4-base .u-btn:hover,.u-palette-4-dark-3 .u-btn:hover,.u-palette-4-dark-2 .u-btn:hover,.u-palette-4-dark-1 .u-btn:hover,.u-palette-4 .u-btn:hover,.u-palette-4-light-1 .u-btn:hover,.u-palette-5-dark-3 .u-btn:hover,.u-palette-5-dark-2 .u-btn:hover,.u-palette-5-dark-1 .u-btn:hover,.u-grey-40 .u-btn:hover,.u-grey-30 .u-btn:hover,.u-grey-90 .u-btn:hover,.u-grey-80 .u-btn:hover,.u-grey-75 .u-btn:hover,.u-black .u-btn:hover,.u-grey-70 .u-btn:hover,.u-grey-60 .u-btn:hover,.u-grey-50 .u-btn:hover,.u-grey-dark-3 .u-btn:hover,.u-grey-dark-2 .u-btn:hover,.u-grey-dark-1 .u-btn:hover,.u-grey .u-btn:hover,.u-shading .u-btn:hover,.u-overlap-contrast .u-header .u-btn:hover\n        {\n        background-color: var(--button-hover-alt-background-color);\n        color: var(--button-hover-alt-color);\n        }\n        .u-custom-color-1 .u-btn:active,.u-body-color .u-btn:active,.u-palette-1-base .u-btn:active,.u-palette-1-dark-3 .u-btn:active,.u-palette-1-dark-2 .u-btn:active,.u-palette-1-dark-1 .u-btn:active,.u-palette-1 .u-btn:active,.u-palette-2-base .u-btn:active,.u-palette-2-dark-3 .u-btn:active,.u-palette-2-dark-2 .u-btn:active,.u-palette-2-dark-1 .u-btn:active,.u-palette-2 .u-btn:active,.u-palette-2-light-1 .u-btn:active,.u-palette-2-light-2 .u-btn:active,.u-palette-3-base .u-btn:active,.u-palette-3-dark-3 .u-btn:active,.u-palette-3-dark-2 .u-btn:active,.u-palette-3-dark-1 .u-btn:active,.u-palette-3 .u-btn:active,.u-palette-4-base .u-btn:active,.u-palette-4-dark-3 .u-btn:active,.u-palette-4-dark-2 .u-btn:active,.u-palette-4-dark-1 .u-btn:active,.u-palette-4 .u-btn:active,.u-palette-4-light-1 .u-btn:active,.u-palette-5-dark-3 .u-btn:active,.u-palette-5-dark-2 .u-btn:active,.u-palette-5-dark-1 .u-btn:active,.u-grey-40 .u-btn:active,.u-grey-30 .u-btn:active,.u-grey-90 .u-btn:active,.u-grey-80 .u-btn:active,.u-grey-75 .u-btn:active,.u-black .u-btn:active,.u-grey-70 .u-btn:active,.u-grey-60 .u-btn:active,.u-grey-50 .u-btn:active,.u-grey-dark-3 .u-btn:active,.u-grey-dark-2 .u-btn:active,.u-grey-dark-1 .u-btn:active,.u-grey .u-btn:active,.u-shading .u-btn:active,.u-overlap-contrast .u-header .u-btn:active\n        {\n        background-color: var(--button-active-alt-background-color);\n        color: var(--button-active-alt-color);\n        }\n        /** alt-color-rules **/\n    </style><style id=\"font-scheme\" font-scheme=\"Roboto-OpenSans\" heading-font=\"Roboto,sans-serif\" text-font=\"'Open Sans',sans-serif\">.u-body {\n   --text-font: 'Open Sans',sans-serif;\n   --heading-font: Roboto,sans-serif;\n}</style>","appVersion":"3.10.2","isTrial":false}